nombre,categoria,sub_categoria,calificacion,precio_descuento,precio_actual
HSR Car Accessories Anti-Slip Car Dashboard Mat & Mobile Phone Holder Mount - Universal Non Slip Sticky Rubber Pad for Sma...,"tv, audio & cameras",All Electronics,3.7,487.0,899.0
"Duracell Specialty 1632 Lithium Coin Battery 3V, Pack of 5 (DL1632/CR1632) Designed for use in keyfobs, Scales, wearables ...","tv, audio & cameras",All Electronics,5.0,203.0,350.0
Gizga Essentials Laptop Power Cable Cord- 3 Pin Adapter Isi Certified(1 Meter/3.3 Feet),"tv, audio & cameras",All Electronics,4.1,189.0,499.0
Worison Pocket Size Spiral Sticky Note Pad,"tv, audio & cameras",All Electronics,4.1,189.0,300.0
Pikkme iPhone 13 Back Cover | Flexible Pu Leather | Full Camera Protection | Raised Edges | Super Soft-Touch | Bumper Case...,"tv, audio & cameras",All Electronics,3.8,299.0,999.0
"pTron Solero i241 2.4A Lighting to USB Fast Charging Data & Sync USB Cable Compatible for iPhone/iPad, Made in India Durab...","tv, audio & cameras",All Electronics,3.3,129.0,599.0
Amazon Brand - Solimo Back Cover Case for Samsung Galaxy M30s / Samsung Galaxy M21 | Compatible for Samsung Galaxy M30s / ...,"tv, audio & cameras",All Electronics,3.9,139.0,299.0
"SWAPKART 2 in 1 OTG Adapter Type c OTG ,Micro USB OTG Micro USB + c c Type ,Converter Adapter Type c and USB 2.0 Male to F...","tv, audio & cameras",All Electronics,4.5,164.0,499.0
OpenTech® Tempered Glass Screen Protector Compatible for OnePlus 8T / 9 with Edge to Edge Coverage and Easy Installation kit,"tv, audio & cameras",All Electronics,4.0,299.0,999.0
Amazon Brand - Solimo Basic Case for Apple iPhone XR (Silicone_Transparent),"tv, audio & cameras",All Electronics,3.8,139.0,499.0
CROSSVOLT 5V/4A Micro USB Vooc Super Fast Data Sync Charging Cable Compatible for Oppo F9 F9 Pro Oppo F11 Pro and All Oppo...,"tv, audio & cameras",All Electronics,4.2,289.0,999.0
TheGiftKart Back Cover Case for Samsung Galaxy M31 Prime / F41 / M31 (Shockproof | Hybrid TPU & PC | Transparent | Black B...,"tv, audio & cameras",All Electronics,4.1,259.0,999.0
Oblivion LCD Writing Tablet/pad 8.5 inches | Electronic Writing Scribble Board for Kids |Kids Learning Toy |for Home/Schoo...,"tv, audio & cameras",All Electronics,4.0,248.0,449.0
OpenTech® Tempered Glass Screen Protector Compatible for Samsung Galaxy M33 / F23 / M23 / A23 / M13 4G with Edge to Edge C...,"tv, audio & cameras",All Electronics,4.0,299.0,999.0
Skynote Fd1 S_S L21 Air-Port Waterproof Stereo Bluetooth Truly Wireless In Ear Earbuds With Mic (Black),"tv, audio & cameras",All Electronics,3.3,484.0,999.0
MENORAH - A4 Sketch Artist Book- Drawing Notebook- 50 Sheets / 100 Pages- (21.0 cm x 29.7 cm)-140 GSM- (Poppy Field) Design,"tv, audio & cameras",All Electronics,4.4,359.0,375.0
Parker Vector Standard Calligraphy CT Fountain Pen (Blue),"tv, audio & cameras",All Electronics,4.2,439.0,550.0
"Panasonic Alkaline 9V Battery, Pack of 1","tv, audio & cameras",All Electronics,4.3,125.0,140.0
"USB Charger, Oraimo Elite Dual Port 5V/2.4A Wall Charger, USB Wall Charger Fast Charging Adapter for iPhone 11/Xs/XS Max/X...","tv, audio & cameras",All Electronics,4.0,299.0,649.0
R A Products LCD Writing Board Slate Drawing Record Notes Digital Notepad with Pen Handwriting Pad Paperless Graphic Table...,"tv, audio & cameras",All Electronics,3.6,159.0,499.0
"Tukzer 2-in-1 Capacitive Stylus Pen V2.0, Precise Stylus -Fine Point Disc Tip & Micro-Knit Hybrid Fiber Tip, Light Aluminu...","tv, audio & cameras",All Electronics,3.8,369.0,999.0
TheGiftKart Tough Armor Bumper Back Case Cover for Vivo V27 / V27 PRO 5G | Ring Holder & Kickstand in-Built | 360 Degree P...,"tv, audio & cameras",All Electronics,5.0,349.0,999.0
Envie Beetle Charger with Envie 4xAA Ni-Cd 1000 Mah Batteries,"tv, audio & cameras",All Electronics,3.8,549.0,595.0
"ZEBRONICS Zeb-Storm Wired On Ear Headphone with 3.5mm Jack, Built in Microphone for Calling, 1.5 Meter Cable, Soft Ear Cus...","tv, audio & cameras",All Electronics,3.8,399.0,799.0
"Pilot V7 Liquid Ink Roller Ball Pen (1 Blue + 1 Black + 1 Red), (9000014717)","tv, audio & cameras",All Electronics,4.4,179.0,210.0
"LIRAMARK Type c Female to Micro USB Male Adapter, Converter USB C to Micro USB, Charger Connector Works with Smartphones, ...","tv, audio & cameras",All Electronics,4.0,104.0,149.0
One94Store Mini Portable USB Hand Fan Rechargeable Battery Operated Personal Table Fan with Standing Holder Handy Pocket B...,"tv, audio & cameras",All Electronics,3.1,349.0,999.0
"Cello Winner Assorted Ball Pen Set, Pack of 60 (50 Blue, 7 Black, 3 Red ink)|Lightweight Ball Pens for Pressure Free and F...","tv, audio & cameras",All Electronics,3.8,390.0,420.0
One94Store Mini Portable USB Hand Fan Rechargeable Battery Operated Personal Table Fan with Standing Holder Handy Pocket B...,"tv, audio & cameras",All Electronics,3.1,339.0,999.0
GadgetBite Anti-Lost Magnetic Strap Silicone Cable String for Apple Wireless Earphones 1 | Apple Wireless Earphones 2 | Ap...,"tv, audio & cameras",All Electronics,3.8,198.0,599.0
LIRAMARK Shockproof Protective Silicone 360° Cover Case with Buckle Designed for JBL Tune 230NC TWS (Black),"tv, audio & cameras",All Electronics,4.0,299.0,599.0
TheGiftKart Ultra-Hybrid Crystal Clear Back Case Cover for Google Pixel 6A | Shockproof Design | Camera Protection Bump | ...,"tv, audio & cameras",All Electronics,4.2,399.0,999.0
Amazon Basics Car Charger with 36W Fast Charging | Dual Port -Type C and USB Output | Micro USB Cable Included (Grey),"tv, audio & cameras",All Electronics,4.3,499.0,916.0
EMBOX 3 Pin Multi Plug Socket-Universal Travel Adapter with Individual Switch Safety Shutter LED Indicator-3 Way Plug Exte...,"tv, audio & cameras",All Electronics,4.3,359.0,369.0
OFIXO 100 Pieces A4 Color Paper Handmade Origami Embossed Multi Color Paper Thin Scrapbook Paper 10 Colors Sent at Random,"tv, audio & cameras",All Electronics,4.3,198.0,999.0
"SupCares Edge to Edge Tempered Glass for OnePlus Nord 2T 5G, OnePlus Nord CE 5G, OnePlus Nord 2 (6.43 Inch) with Easy Self...","tv, audio & cameras",All Electronics,4.1,289.0,799.0
"VERVENIX Hand Free Neck Fan, Rechargeable Mini USB Personal Fan with 360 Rotation, 3 Adjustable Speeds for Home, Sport, Ca...","tv, audio & cameras",All Electronics,4.1,519.0,999.0
"Parker Quink Roller Ball Refill (Blue), Pack of 1 (9000012124)","tv, audio & cameras",All Electronics,4.1,98.0,100.0
Mexa Acoustic Guitar Bag Compatible With 38; 39; 40; 41; Inches Guitar Like - Fender; Yamaha; Cort; Ibanez; Xtag; Ashton; ...,"tv, audio & cameras",All Electronics,4.4,699.0,999.0
SanDisk ® Ultra Curve USB 3.2 32GB 100MB/s R Black,"tv, audio & cameras",All Electronics,4.2,349.0,650.0
"NIVIA Spikester (Encounter) 494 Polypropylene Volleyball, Size - 4 (Multicolour)","tv, audio & cameras",All Electronics,3.9,639.0,790.0
AmazonBasics D Cell Everyday Alkaline Batteries (4-Pack),"tv, audio & cameras",All Electronics,4.3,419.0,800.0
TheGiftKart OnePlus Nord CE 2 LITE 5G Back Case Cover | Tough Armor Bumper | Ring Holder & Kickstand in-Built | 360 Degree...,"tv, audio & cameras",All Electronics,4.4,395.0,999.0
BROTHER BT5000M Ink Bottle (Magenta),"tv, audio & cameras",All Electronics,4.3,408.0,490.0
"Camin LCD Writing Tablet 8.5 Inch Screen, Kids Toy, LCD Writing pad, Writing Tablet Toys for 3+ Years (Black Color)","tv, audio & cameras",All Electronics,4.1,139.0,499.0
Boldfit Mi Band 4 Strap Mi Band 3 Strap For Smart Watch Mi Fit Band Strap Watch Straps For Mi Band 4 Strap And Mi Band 3 S...,"tv, audio & cameras",All Electronics,4.5,199.0,499.0
BROTHER BT5000C Ink Bottle (Cyan),"tv, audio & cameras",All Electronics,4.3,408.0,490.0
"Parker Vector Standard Fountain Pen (Body - Black, Ink - Black with free 1 cartridge)","tv, audio & cameras",All Electronics,4.1,379.0,430.0
"LOXXO® Camera Lens Protector Compatible for iPhone 14 Pro/iPhone 14 Pro Max, [Anti-Scratch] Premium Tempered Glass Film Al...","tv, audio & cameras",All Electronics,3.7,279.0,999.0
Quantum RJ45 Ethernet Patch/LAN Cable with Gold Plated Connectors Supports Upto 1000Mbps - (3 Meters) - (White),"tv, audio & cameras",All Electronics,4.3,199.0,299.0
Navneet Youva | Soft Bound Long Book | A4 Size - 21 Cm X 29.7 Cm | Rainbow Design Notebook For Students | Single Line | 17...,"tv, audio & cameras",All Electronics,4.5,404.0,450.0
Digiway Maser Universal Wall Mount Stand for 14 inch to 32 inch LCD & LED TV,"tv, audio & cameras",All Electronics,3.6,249.0,499.0
"AmazonBasics RJ45 Cat 7 High-Speed Gigabit Ethernet Patch Internet Cable for Printer, Server (10Gbps, 600MHz - Black, 3-Feet)","tv, audio & cameras",All Electronics,4.4,159.0,500.0
POPIO Tempered Glass Screen Protector Compatible for Samsung Galaxy A32 4G / Samsung Galaxy M32 4G / Samsung Galaxy F22 / ...,"tv, audio & cameras",All Electronics,3.9,150.0,599.0
OpenTech® Tempered Glass Screen Protector Compatible for iPhone 14 Pro Max with Edge to Edge Coverage and Easy Installatio...,"tv, audio & cameras",All Electronics,4.3,299.0,999.0
BROTHER BT5000Y Ink Bottle (Yellow),"tv, audio & cameras",All Electronics,4.3,408.0,490.0
"Dyazo 3-Port USB Data Hub High Speed Splitter Plug / Box / Adapter Expansion , Small, Compact, Universal Data Transfer, Wi...","tv, audio & cameras",All Electronics,4.1,299.0,799.0
"Portronics Clamp M Car Mobile Holder with 360° Rotational, Strong Suction Cup, One Click Release Button Compatible with 4 ...","tv, audio & cameras",All Electronics,4.0,375.0,799.0
"Avedia Mobile Phone Dustproof Net Stickers, Speaker Mesh Anti Dust Proof Adhesive Sticker for iPhone and Android Phone Spe...","tv, audio & cameras",All Electronics,3.9,269.0,999.0
"DIGITEK® (DLS-006FT) Lightweight & Portable Aluminum Alloy Light Stand for Ring Light, Reflector, Flash Units, Diffuser, P...","tv, audio & cameras",All Electronics,4.3,699.0,995.0
MYVN Warp charging cable compatible for OnePlus 7 Pro / 7T / 7T Pro and Dash charge for OnePlus 3 / 3T / 5 / 5T / 6 / 6T / 7,"tv, audio & cameras",All Electronics,4.1,299.0,999.0
"Verilux® USB C Hub, USB Hub with 4 USB Ports, High Speed Aluminum Type C Hub Compatible with MacBook, Windows, C-Type Smar...","tv, audio & cameras",All Electronics,4.1,394.0,839.0
OMOTON Advanced HD+ Tempered Glass Screen Protector Compatible for Google Pixel 6a Edge to Edge with Easy Installation Kit,"tv, audio & cameras",All Electronics,4.4,251.0,999.0
"SIDRUM WF-18 DSLR/SLR Camera Shoulder Bag Case with Adjustable Shoulder Strap & Rain Cover, Compatible for Nikon, Canon, S...","tv, audio & cameras",All Electronics,4.4,664.0,899.0
"Ceptics Adapter to UK, India to UAE, Hong Kong, Dubai, UK Adapter Plug - UK Travel Adapter - Type G Adapter - Perfect for ...","tv, audio & cameras",All Electronics,4.3,332.0,749.0
"Gizga Essentials Laptop Bag Sleeve Case Cover Pouch for 15.6 Inch Laptop/MacBook, Office/ College Laptop Bag for Men & Wom...","tv, audio & cameras",All Electronics,4.3,299.0,999.0
Uniball Eye Ball Point Pen - Pack of 5 (BLACK),"tv, audio & cameras",All Electronics,4.4,360.0,450.0
Amozo Back Cover For iPhone 12/ 12 Pro ( TPU|Black ),"tv, audio & cameras",All Electronics,4.1,284.0,899.0
"Printme Silicone Compatible for OnePlus Buds Nord CE Case Cover, Soft Shockproof Protective Case Cover with Metal Keychain...","tv, audio & cameras",All Electronics,3.9,239.0,899.0
TheGiftKart Back Cover Case for OnePlus Nord 2 5G / OnePlus Nord 2 5G Pac-Man Edition (Crystal Clear | Shockproof | Hybrid...,"tv, audio & cameras",All Electronics,4.3,284.0,999.0
LOHAYA LCD/LED Remote Compatible for Sony Bravia Smart LCD LED UHD OLED QLED 4K Ultra HD TV Remote Control with YouTube & ...,"tv, audio & cameras",All Electronics,3.5,331.55,999.0
"Amazon Basics USB 3.0 Extension Cable for Personal Computer, Printer - A-Male to A-Female - 6.5 Feet (2 Meters), Black","tv, audio & cameras",All Electronics,4.5,399.0,445.0
OpenTech® Tempered Glass Screen Protector Compatible for Samsung Galaxy S22 5G / S23 5G with Edge to Edge Coverage and Eas...,"tv, audio & cameras",All Electronics,3.9,299.0,999.0
"Doodle Initial S Premium Soft Bound Notebook Diary for Girls and Women (B6,192 Theme Based Ruled Pages, 80 GSM) Floral Design","tv, audio & cameras",All Electronics,4.3,279.0,445.0
VMPS | Remote Control Compatible for Daikin Air Conditioner Split & Window Daikin AC Remote as Same,"tv, audio & cameras",All Electronics,4.1,499.0,999.0
"Sounce Earphone Case Cover Compatible with Boat Airdopes 141, Soft Silicone Skin Case Cover Shock-Absorbing Protective Cas...","tv, audio & cameras",All Electronics,4.0,199.0,999.0
"King Shine Multi Retractable 3.0A Fast Charger Cord, Multiple Charging Cable 4Ft/1.2m 3-in-1 USB Charge Cord Compatible wi...","tv, audio & cameras",All Electronics,3.5,337.0,999.0
TheGiftKart Ultra-Hybrid Back Case Cover for Samsung Galaxy S20 FE / S20 FE 5G | Crystal Clear Hard Back | Shockproof Desi...,"tv, audio & cameras",All Electronics,4.3,399.0,999.0
"STRIFF Wall Mount Phone Holder with Adhesive Strips, Charging Holder Compatible with iPhone, Smartphone and Mini Tablet(Pa...","tv, audio & cameras",All Electronics,4.1,149.0,499.0
Hello Zone Exclusive Matte Finish Soft Back Case Cover for Xiaomi Mi Redmi Note 8 Pro - Black,"tv, audio & cameras",All Electronics,4.2,149.0,699.0
TheGiftKart Back Cover Case for Google Pixel 6A Back Cover Case | Soft Silicon Rubberised Matte Cover | Protective Sleek P...,"tv, audio & cameras",All Electronics,4.3,299.0,999.0
Lowfe Noise_Colorfit Smart Watch Charger 2 Pin USB Fast Charger Magnetic Charging Cable Adapter (Smart Watch Charger 2 pin),"tv, audio & cameras",All Electronics,4.2,249.0,999.0
"Sounce Cat6 Ethernet Cable 10 Meter/ 550 MHz Outdoor & Indoor, Upto 10 Gbps Support Cat6 Network, Heavy Duty Flat LAN Inte...","tv, audio & cameras",All Electronics,3.7,199.0,449.0
Bennett Nylon Drax Laptop Bag Sleeve Case Cover Pouch for 14 inches Laptop Apple/Dell/Lenovo/ASUS/Hp/Samsung/Mi/MacBook/Ul...,"tv, audio & cameras",All Electronics,4.1,299.0,999.0
POPIO Tempered Glass Screen Protector Compatible for iPhone 14 Pro Max with Edge to Edge Coverage and Easy Installation ki...,"tv, audio & cameras",All Electronics,4.4,150.0,599.0
Tizum Mouse Pad/ Computer Mouse Mat with Anti-Slip Rubber Base | Smooth Mouse Control | Spill-Resistant Surface for Lapto...,"tv, audio & cameras",All Electronics,4.4,129.0,399.0
"OpenTech ® Tempered Glass Screen Protector Compatible for Samsung Galaxy Watch 4 Classic (46mm, Pack of 2) with Easy Insta...","tv, audio & cameras",All Electronics,4.4,399.0,999.0
"Parker Frontier Matte Black (Gold Nib) GT Fountain Pen, 1 Count (Pack of 1) (9000020642)","tv, audio & cameras",All Electronics,4.1,742.0,825.0
"GO SHOPS Watch Charger Compatible with Apple Watch Charger, Magnetic Charging Cable for iWatch Series 8/7/6/SE/5/4/3/2,Por...","tv, audio & cameras",All Electronics,2.7,299.0,999.0
Quantum QHM8106 USB to RJ45 Ethernet LAN Adapter (White),"tv, audio & cameras",All Electronics,3.7,449.0,699.0
"Ceptics USA to India Converter Plug, World (USA, China) Australia UK to India Plug Converter - Type D Plug Adapter - Canad...","tv, audio & cameras",All Electronics,4.3,340.0,749.0
𝟐𝟎𝟐𝟐 𝐔𝐩𝐠𝐫𝐚𝐝𝐞𝐝 for Apple Watch Charger Magnetic Fast Charging Cable [Portable] Magnetic Wireless Charging Compa...,"tv, audio & cameras",All Electronics,3.2,299.0,999.0
"anchor by panasonic 22841 6A 3 Pin Multiplug Adaptor (White & Black, Pack of 2)","tv, audio & cameras",All Electronics,4.6,228.0,330.0
"SKY BUYER Bluetooth Smart Touchscreen Smart Watch Bluetooth 1.3 HD Screen Smart Watch with Daily Activity Tracker, Heart R...","tv, audio & cameras",All Electronics,3.4,599.0,999.0
Crysendo Spiral Cable Protector | Triple Color (3 Pcs) 1.5 Meters | 35+ Available Colours | Cable Cord Charger Protector S...,"tv, audio & cameras",All Electronics,4.2,299.0,849.0
"WOW IMAGINE Shock Proof Clear Protective TPU, PC Back Cover Case for Nothing Phone 1 5G - AirEDGE Technology 360 Degree Ca...","tv, audio & cameras",All Electronics,4.0,189.0,999.0
Duracell Ultra Alkaline Battery AAA - 20 Pieces,"tv, audio & cameras",All Electronics,4.5,713.0,750.0
Quess Care Extended Warranty Plan for 2 Year for TV Between 10001 to 15000 (Email Delivery),"tv, audio & cameras",All Electronics,3.9,851.0,999.0
"Success Stationery Hero Pen Original Fountain Ink Pen Iridium Nib Model 329 Silver Cap, Black Green Maroon - Pack of 3","tv, audio & cameras",All Electronics,4.1,549.0,900.0
"Zinq Technologies Super Durable Micro to USB 2.0 Round Cable with High Speed Charging, Quick Data Sync and PVC Connectors ...","tv, audio & cameras",All Electronics,3.8,87.0,799.0
"POPIO Camera Lens Protector for iPhone 13 / iPhone 13 Mini (Transparent), Pack of 2","tv, audio & cameras",All Electronics,3.9,251.0,599.0
"MYVN 65W Super Vooc Charge, Data Sync Fast charging Type-C Cable Compatible for Realme XT, Realme XT 730G, Realme X2, Real...","tv, audio & cameras",All Electronics,4.1,329.0,999.0
"Zebronics CU3100V Fast charging Type C cable with QC 18W support, 3A max capacity, 1 meter braided cable, Data transfer an...","tv, audio & cameras",All Electronics,3.7,209.0,549.0
"Mobomart Pro 5 Bluetooth Truly Wireless Ear Earbuds, Blutooth 5.0 Earbuds","tv, audio & cameras",All Electronics,3.0,379.0,999.0
Pikkme iPhone 11 Back Cover | Flexible Pu Leather | Full Camera Protection | Raised Edges | Super Soft-Touch | Bumper Case...,"tv, audio & cameras",All Electronics,3.9,299.0,999.0
SVM Products Unbreakable Set Top Box Stand with Dual Remote Holder (Black),"tv, audio & cameras",All Electronics,3.6,156.0,399.0
Rhymestore® 4 Pin USB Fast Charger Magnetic Charging Cable Adapter for Fire-Boltt Thunder Watch & Fire-Boltt Talk Smartwat...,"tv, audio & cameras",All Electronics,4.4,265.0,499.0
Classmate Archimedes Geometry Box | Die- Cast Compass | Mechanical Pencil | Double sided tray,"tv, audio & cameras",All Electronics,4.4,138.0,170.0
"WONDER Double Side Foam Tape 2 inch Width,48mmX5 Mtr Set of 2","tv, audio & cameras",All Electronics,3.9,145.0,255.0
"Tombow 57316 Mono Zero Eraser Value Pack, Round 2.3 mm. Precision Tip Eraser with Refills","tv, audio & cameras",All Electronics,4.4,299.0,450.0
AmazonBasics 3A Fast Charging L Shaped Braided USB A to USB Type C Data cable for Smartphone (Black/White -1.2 Meter),"tv, audio & cameras",All Electronics,4.3,299.0,599.0
"Techmount� Replacement Silicone Band Straps Compatible with Xiaomi MI Band 3 & 4 (Xiaomi MI Band 3 & 4, Black/Grey/Navy-Bl...","tv, audio & cameras",All Electronics,4.2,299.0,999.0
SupCares Edge to Edge Tempered Glass for Samsung Galaxy S21 FE 5G (6.4 Inch) with Easy Self Installation Kit | Black,"tv, audio & cameras",All Electronics,4.2,289.0,799.0
Amazon Brand - Solimo Back Cover for LG G8X ThinQ (Silicone_Clear),"tv, audio & cameras",All Electronics,4.3,169.0,499.0
Zapcase Thermoplastic Polyurethane Back Case Cover for iPhone 13 | Compatible for iPhone 13 Back Case Cover | Scratch-Resi...,"tv, audio & cameras",All Electronics,4.2,499.0,899.0
Eveready Ultima Alkaline AA Battery - Pack of 4,"tv, audio & cameras",All Electronics,4.3,112.0,170.0
"Quantum RJ45 Ethernet Patch/LAN/Router Cable with Gold Plated Connectors Supports Upto 1000Mbps -16.4Feet (5 Meters), White","tv, audio & cameras",All Electronics,4.3,229.0,499.0
"Smashtronics® - Case for Firetv Remote, Fire Stick Remote Cover Case, Silicone Cover for TV Firestick 4K/TV 2nd Gen(3rd Ge...","tv, audio & cameras",All Electronics,4.2,199.0,399.0
Sounce Anti Fall Dust Protection Case Cover Compatible with Oppo Enco Buds Headphones Case Silicone Headset case with Keyc...,"tv, audio & cameras",All Electronics,4.3,99.0,999.0
Xynity 's Advanced HD+ Tempered Glass Screen Protector Designed for Google Pixel 6A - Edge to Edge Full Screen Coverage wi...,"tv, audio & cameras",All Electronics,4.4,245.0,999.0
"ELV Direct Wall Mount Mobile Holder, Charging Holder Compatible All Smartphone and Remote Stand/Organizer/Showpiece for Tv...","tv, audio & cameras",All Electronics,4.1,149.0,499.0
"Ambrane 12W Fast Car Charger, Dual USB Output, Multi-Layer Protection, Fast Charging, Compatible with All Cars, Without Ca...","tv, audio & cameras",All Electronics,3.9,249.0,999.0
LRIPL Compatible Sony Bravia LCD/led Remote Works with Almost All Sony led/LCD tv's,"tv, audio & cameras",All Electronics,3.9,389.0,399.0
Winble Back Cover for iPhone 14 Pro Case | Metal Camera Guard Acrylic Clear Protective Back | Back Cover Case for iPhone 1...,"tv, audio & cameras",All Electronics,4.2,499.0,999.0
"Portronics Konnect Spydr 31 3-in-1 Multi Functional Cable with 3.0A Output, Tangle Resistant, 1.2M Length, Nylon Braided(Z...","tv, audio & cameras",All Electronics,3.5,242.0,899.0
OpenTech® Tempered Glass Screen Protector Compatible for iQOO 7 5G / iQOO 7 Legend 5G / iQOO 9 SE 5G with Edge to Edge Cov...,"tv, audio & cameras",All Electronics,4.3,299.0,999.0
ABOUT SPACE Multipurpose Scissors Set - (Set of 3) Stainless Steel Multicoloured Scissors at Different Sizes for Househol...,"tv, audio & cameras",All Electronics,4.2,299.0,599.0
JGD PRODUCTS for Samsung Galaxy S21 FE 5G Premium Transparent Hybrid Soft Slim Dust Proof Back Case Cover with Camera Prot...,"tv, audio & cameras",All Electronics,4.1,159.0,699.0
AmazonBasics Stapler with 1000 Staples - Black,"tv, audio & cameras",All Electronics,4.3,319.0,700.0
"ONUMTZ 30W USB-C Female to Lightning Cable Adapter, Type-C to 8 Pin Male PD Fast Charging Converter Cord Data Sync Connect...","tv, audio & cameras",All Electronics,3.2,189.0,999.0
"HUMBLE® Universal Mobile Holder for Car Windshield/Dashboard with One Touch Technology Phone Stand for Car, Extendable Arm...","tv, audio & cameras",All Electronics,3.9,299.0,699.0
"BESTOR LCD Writing Tablet 10 Inch, Colorful Doodle Board Drawing Pad for Kids, Drawing Board Writing Board Drawing Tablet,...","tv, audio & cameras",All Electronics,3.8,499.0,999.0
Amazon Brand - Solimo Back Cover for Oneplus 7T (Silicone_Transparent),"tv, audio & cameras",All Electronics,4.0,139.0,499.0
"VOYEE V33 Gaming Bluetooth Truly Wireless in Ear Earbuds with Mic TWS 5.2 Ipx5 Water/Sweat Resistant, Deep Bass, 60 Ms Low...","tv, audio & cameras",All Electronics,3.7,699.0,899.0
"pTron Solero 331 3.4Amps Multifunction Fast Charging Cable, 3-in-1 USB Cable Micro USB/Type-C/iOS, Made in India, Durable...","tv, audio & cameras",All Electronics,3.9,249.0,931.0
"Humble Silicone 19mm Replacement Band Strap with Metal Buckle Compatible with Noise Colorfit Pro 2 , Storm Smart Watch & W...","tv, audio & cameras",All Electronics,3.9,236.0,599.0
CROSSVOLT Compatible Dash/Warp Data Sync Fast Charging Cable Supported for All C Type Devices [Cable],"tv, audio & cameras",All Electronics,4.2,289.0,999.0
ENVIE® (ECR 11) Speedster Fast Charger for AA & AAA Rechargeable Batteries (with LCD Display),"tv, audio & cameras",All Electronics,3.9,690.0,995.0
TheGiftKart Flip Back Cover Case for Samsung Galaxy M33 5G | Dual-Color Leather Finish | Inbuilt Stand & Pockets | Wallet ...,"tv, audio & cameras",All Electronics,4.3,299.0,999.0
TheGiftKart Ultra-Hybrid Crystal Clear Back Case Cover for iPhone 13 | Shockproof Design | Camera Protection Bump | Hard C...,"tv, audio & cameras",All Electronics,4.2,259.0,999.0
TheGiftKart Back Cover for Redmi Note 10 Lite/Note 9 Pro/Pro Max/Poco M2 Pro (Poly Carbonate | Black | Armor),"tv, audio & cameras",All Electronics,4.3,379.0,999.0
LKMO New Trending Universal 360 ° Rotation Car Dashboard Mobile Phone Holder Mount for All Mobile Phone 3.5-7 inch,"tv, audio & cameras",All Electronics,5.0,299.0,999.0
Sounce Mi Band 3 / 3i USB Adapter Power Charger Charging Cable Dock Charger Compatible for Xiaomi Mi Band 3 /3i Smart Brac...,"tv, audio & cameras",All Electronics,3.8,149.0,999.0
"Soomio Compatible for iPhone Charger Case Cover, Funny Cartoon Character, Silicone Charger Case Cover Compatible for 18-20...","tv, audio & cameras",All Electronics,3.3,399.0,999.0
Sounce VGA to HDMI 1080P Full HD Mini VGA to HDMI Audio Video Converter Adapter Box with USB Cable and 3.5mm Audio Port Ca...,"tv, audio & cameras",All Electronics,4.2,299.0,999.0
Airtel DigitalTV DTH Remote SD/HD/HD Recording Compatible for Television (Shining Black ),"tv, audio & cameras",All Electronics,3.7,199.0,499.0
"AmazonBasics USB Type-C to USB-A 2.0 Male Fast Charging Cable for Laptop - 3 Feet (0.9 Meters), Black","tv, audio & cameras",All Electronics,4.3,249.0,700.0
"Astigo Compatible Remote Control for Mi Smart LED 4A (43""/32"")","tv, audio & cameras",All Electronics,3.6,284.0,599.0
"theKiteco. Wall Mounted Mobile Holder Storage Case for Remote, Wall Mounted Mobile Stand/Multi Purpose Stand with Hole for...","tv, audio & cameras",All Electronics,4.1,169.0,399.0
YellowInc Case Cover Compatible with OnePlus Nord Buds (Earbuds Not Included) (Black),"tv, audio & cameras",All Electronics,3.9,299.0,499.0
GadgetBite External Printed Hard Drive Disk Enclosure Portable Carrying Case Cover Pouch Casing for 2.5-Inch Hard Drive (G...,"tv, audio & cameras",All Electronics,4.2,199.0,599.0
"3M Scotch Magic Tape Roll with Refillable Dispenser | 1.9cm x 32.9 meter | Invisible, writable and hand tearable | For sch...","tv, audio & cameras",All Electronics,4.5,169.0,185.0
"anchor by panasonic 22061 6A Power Strip 4 Socket Spike Guard with Single Switch (1.5 m, White and Blue)","tv, audio & cameras",All Electronics,4.0,400.0,509.0
TheGiftKart Shockproof Crystal Clear Back Cover Case for iQOO Neo 7 5G | 360 Degree Protection | Protective Design | Trans...,"tv, audio & cameras",All Electronics,4.7,225.0,999.0
OpenTech® Tempered Glass Screen Protector Compatible for OnePlus 9R with Edge to Edge Coverage and Easy Installation kit,"tv, audio & cameras",All Electronics,4.0,299.0,999.0
"BESTOR® Doodle LCD Pad Writing Tablet for Kids 10 Inch, Doodle Board Drawing Tablet with Lock Function, Erasable Reusable ...","tv, audio & cameras",All Electronics,3.8,499.0,999.0
