nombre,categoria,sub_categoria,calificacion,precio_descuento,precio_actual
OpenTech® Silicone Protection Bumper Case Cover for Samsung Galaxy Watch 4 (44mm) Full Coverage (Black),"tv, audio & cameras",All Electronics,4.4,399.0,999.0
FriendZon 9H Nano Tempered Glass Screen Protector Compatible with Royal Enfield Meteor 350 / Scram 411 / Hunter 350 (Pack ...,"tv, audio & cameras",All Electronics,4.1,199.0,299.0
"Oblivion Multi-Purpose Wall Holder Stand for Charging Mobile Just Fit in Socket, Support All Charger and Hang (Red)","tv, audio & cameras",All Electronics,4.5,149.0,299.0
"TAAPSEE DC 12V 2A Power Supply Adapter, AC 100-240V to DC 12Volt Transformers, Switching Power Source 3528/5050 LED Strip ...","tv, audio & cameras",All Electronics,3.5,249.0,799.0
CEDO Redmi 10A / Poco C31 Back Cover | Matte Soft Silicon Flexible | Camera Bump Protection | All Side Shock Proof Rubberi...,"tv, audio & cameras",All Electronics,3.9,149.0,999.0
"TRUE HUMAN Panda Pencil Pouch Pencil case for Girls ,Kids and Students","tv, audio & cameras",All Electronics,4.1,219.0,900.0
"Admiz Cleaner Fluid Gel LCD Cleaning Kit, Liquid Solution with Cloth to Clean Mobile/Laptop Screen Pack of 3","tv, audio & cameras",All Electronics,3.8,155.0,499.0
"Amazon Basics Mini Car Charger with Dual Output, Fast Charging (Type C 20W + Type A 3.0A) Compatible with All Smartphones(...","tv, audio & cameras",All Electronics,4.2,569.0,699.0
TheGiftKart Tough Armor Samsung Galaxy M33 5G Bumper Back Case Cover | Ring Holder & Kickstand in-Built | 360 Degree Prote...,"tv, audio & cameras",All Electronics,4.3,395.0,999.0
Amozo Shockproof Liquid Silicone Designed for iPhone 14 / iPhone 13 Back Cover Case Gel Rubber Full Body Protection Anti-S...,"tv, audio & cameras",All Electronics,4.0,284.0,999.0
TheGiftKart Shockproof Crystal Clear Back Cover Case for Oppo A78 5G | 360 Degree Protection | Protective Design | Transpa...,"tv, audio & cameras",All Electronics,5.0,199.0,999.0
Alifiya Polyester Tablet Sleeve/Laptop Sleeve Bag/Case Cover Upto 11.6 inch for iPad/Samsung Galaxy/Lenovo (Grey_L20),"tv, audio & cameras",All Electronics,4.3,299.0,399.0
AmazonBasics 3.5mm to 2-Male RCA Adapter cable - 4 feet,"tv, audio & cameras",All Electronics,4.4,439.0,800.0
"HUMBLE® Bike Phone Holder, 360 Rotation Silicone Bicycle Phone Holder/Mount, Universal Motorcycle Handlebar Mount Compatib...","tv, audio & cameras",All Electronics,4.1,255.0,599.0
Kadence Drum Stick Maple Wooden Tip 7A,"tv, audio & cameras",All Electronics,4.3,279.0,330.0
EHOP Remote Control Compatible for Panasonic Split AC 44A,"tv, audio & cameras",All Electronics,3.8,399.0,799.0
"HUMBLE Universal Waterproof Smartphone Protective Pouch for Pool, Beach for All Smartphones-Random Color","tv, audio & cameras",All Electronics,3.9,199.0,599.0
ANM Remote Compatible for Lloyd AC Remote (Exactly Same Remote Will ONLY Work) - with Complementary Batteries,"tv, audio & cameras",All Electronics,3.6,395.0,999.0
TheGiftKart Sleek Back Cover Case for Google Pixel 6A | Slim Fit Protective Design | Ultra Matte Finish | Camera Protectio...,"tv, audio & cameras",All Electronics,4.3,299.0,999.0
Parker Frontier Gold Roller Ball Pen Gt,"tv, audio & cameras",All Electronics,4.3,805.0,900.0
REMOTEX Remote Compatible for Blue Star/Voltas/Hitachi/Onida Split/Window AC Remote Control Model :- R51M/CE (Please Match...,"tv, audio & cameras",All Electronics,3.7,285.0,399.0
Portronics Car Power 6 Car Charger with Dual USB Port for Cellular Phones (PD+QC) 38 Watt(Black),"tv, audio & cameras",All Electronics,4.4,508.0,899.0
Rhymestore 360 Degree Universal Mobile Cellphone Stand car Accessories Smartphone Holder Phone Mount Phone Holder,"tv, audio & cameras",All Electronics,4.0,275.0,399.0
Pikkme Oppo F9 / F9 Pro / A5 / A5s /A7 / A11k /A12/ Realme 2 / 2 Pro / Realme U1 Flip Cover Magnetic Leather Wallet Case S...,"tv, audio & cameras",All Electronics,4.2,199.0,999.0
"SWAPKART [2 PACK Fast Charging Cable and Data Sync USB Cable Compatible for iPhone 6/6S/7/7+/8/8+/10/11, 12, 13 Pro max iP...","tv, audio & cameras",All Electronics,4.0,299.0,699.0
"upReale Universal PUBG & Free Fire Game Pro Player Full Hand Gaming Gloves, Anti-Sweat Breathable, Touch Finger Nano-Silve...","tv, audio & cameras",All Electronics,5.0,199.0,215.0
Universal a.c. Remote Baba 1001 (Pack of 1),"tv, audio & cameras",All Electronics,4.0,299.0,699.0
INEFABLE Mi Band 5 and 6 Straps Original for Mi Band M5 and M6 Wristband Strap Soft Silicone Adjustable Band Strap-Device ...,"tv, audio & cameras",All Electronics,3.7,159.0,799.0
LTZ Foldable Mobile Stand for Wall | Multi-Purpose Mobile Holder Charging Stand with 3 pin Plug | Phone Stand with Univers...,"tv, audio & cameras",All Electronics,5.0,249.0,999.0
OpenTech® Tempered Glass Screen Protector Compatible for iPhone XR / 11 (Transparent) Full Screen Coverage (Except Edges) ...,"tv, audio & cameras",All Electronics,4.1,299.0,999.0
YOUTH MOBI Tempered Glass Screen Protector For Apple Watch Ultra (49mm) With Easy Installation Kit; Transparent - Pack of 1,"tv, audio & cameras",All Electronics,4.0,143.0,599.0
ZEBRONICS Zeb-Grace Wired Over The Ear Headphone with Mic (Black),"tv, audio & cameras",All Electronics,3.4,481.0,899.0
Action Pro 4-Way Adjustment Base Front Chin Mount Full Face Helmet Compatible with GoPro Hero 10 9 8 7 6 5 4 3+ 3 SJCAM YI...,"tv, audio & cameras",All Electronics,3.7,268.0,599.0
Amazon Brand - Solimo Acrylic Transparent Case (Hard Back & Soft Bumper Cover with Cushioned Edges) for Apple iPhone 7,"tv, audio & cameras",All Electronics,4.0,149.0,499.0
Pikkme Bumper Back Cover for Samsung Galaxy M21 2021 / M21 / M30S (TPU | Black | Solid),"tv, audio & cameras",All Electronics,4.0,199.0,259.0
Amozo Frameless Slim Design Translucent Matte Back Case Cover for iPhone 13 (Polycarbonate|Blue),"tv, audio & cameras",All Electronics,4.0,284.0,999.0
Verilux® Universal Touch Stylus S Pen Replacement Stylus Pen Refill Tool Kit for Samsung Galaxy Note 10 / Note10+Plus / No...,"tv, audio & cameras",All Electronics,3.7,435.0,608.0
"Ash & Roh® 50Pcs Cute Animal Stickers,Vinyl Waterproof Stickers for Laptop,Bumper,Skateboard,Water Bottles,Computer,Phone,...","tv, audio & cameras",All Electronics,3.9,199.0,599.0
UniqueArt White Stone God Ganesha with Rosewooden Base Car Dashboard Decor Statue | Hindu Idol God Ganesh Ganpati Decor Sc...,"tv, audio & cameras",All Electronics,4.3,299.0,499.0
TheGiftKart Ultra-Hybrid Crystal Clear Back Case Cover for Samsung Galaxy S23 5G | Shockproof Design | Camera Protection B...,"tv, audio & cameras",All Electronics,4.6,399.0,999.0
Pikkme Vivo Y12 / Y15 / Y17 / U10 Back Cover Soft Matte Liquid Silicone TPU | Camera Protection | Shockproof Slim Back Cas...,"tv, audio & cameras",All Electronics,4.1,199.0,999.0
AUNO Standard Multi-Purpose Laptop Table with Dock Stand/Study Table/Bed Table/Foldable and Portable/Ergonomic & Rounded E...,"tv, audio & cameras",All Electronics,4.5,249.0,699.0
"DYAZO Slim 15 "" to 15.6 Inch Laptop Sleeve, Laptop Case with Handle & Accessories Pocket Universal Compatible for Dell, H...","tv, audio & cameras",All Electronics,4.4,249.0,999.0
"Sounce Essentials Professional 6-in-1 Cleaning Kit for Cameras & Sensitive Electronics (Includes: Air Blower, Cotton Swab...","tv, audio & cameras",All Electronics,4.6,299.0,999.0
"Luxor 5 Subject Single Ruled Notebook - B5, 70 GSM, 300 pages","tv, audio & cameras",All Electronics,4.4,120.0,200.0
REDTECH Noise Pulse Go Buzz SmartWatch Charger 2 Pin USB Fast Charger Magnetic Charging Cable Adapter (Smart Watch Charger...,"tv, audio & cameras",All Electronics,3.3,199.0,999.0
Stealodeal Headset Headphone Carrying Case Earpads Storage Bag Headphone Pouch Portable Anti-Pressure (EVA-Black),"tv, audio & cameras",All Electronics,4.3,469.0,999.0
Navneet HQ | Five Subject Spiral Wiro Bound Notebook | 14.8x21 cm |Single Line |300 Pages |Black,"tv, audio & cameras",All Electronics,4.4,164.0,190.0
Quess Care Extended Warranty Plan for 2 Year for Washing Machine Between 15001 to 20000(Email Delivery),"tv, audio & cameras",All Electronics,3.9,749.0,871.0
Mobistyle Compatible for iPhone 11 Case 6.1 inch Hybrid PC+TPU Soft Grip Clear Back Panel Enhanced Metal Camera Guard Back...,"tv, audio & cameras",All Electronics,3.8,424.0,999.0
"Prolet 20MM Silicone Strap Compatible with Amazfit GTS 2 Mini, Amazfit Bip/Bip U/Pro/Lite, Bip S, Amazfit GTS/ 2/2e, Amazf...","tv, audio & cameras",All Electronics,4.0,296.0,369.0
CEDO Clear Case for iPhone 11 | Soft Flexible Full Protection Shock Proof TPU Back Cover for iPhone 11 (Transparent),"tv, audio & cameras",All Electronics,4.0,199.0,999.0
Yogi MART 'Foldable Bed Study Table Portable Multifunction Lapt Lapdesk Children Bed Foldabe Table Work Office Home with T...,"tv, audio & cameras",All Electronics,3.9,219.0,699.0
Amazon Brand - Solimo Back Cover for Samsung Galaxy M31 Prime / M31 / F41 (Silicone | Clear),"tv, audio & cameras",All Electronics,3.8,139.0,499.0
RUSHIL WERE Wall Holder with Mobile Charging Point/Stationary Storage/Bathroom qacceceries/Remote Holder/makup Brush Holde...,"tv, audio & cameras",All Electronics,3.6,104.0,499.0
WOW IMAGINE for Samsung Galaxy F13 M13 4G Slim Ultra Soft Rubberised Back Cover Inner Velvet Fabric Lining Matte Silicone ...,"tv, audio & cameras",All Electronics,4.4,199.0,999.0
NISHTECH (BLACK HD tempered glass for Redmi 10 / Redmi 10C / Redmi 10 Power - Full Edge to Edge Screen Coverage,"tv, audio & cameras",All Electronics,3.8,149.0,699.0
"MMOBIEL E-8000 Glue 50 ml - Strong Glue for All Purpose Repair Glue for Mobiles, Jewellery, Shoes and more - Transparent A...","tv, audio & cameras",All Electronics,3.8,289.0,799.0
"FEDUS 10 Meter 32.8 Feet Long Switch Board Extension | Pack 1 Extension Boards with Switch,Extension Board with Long Wire,...","tv, audio & cameras",All Electronics,4.3,493.0,899.0
Luxor Fine Writer Black Color (pack Of 10 Pen),"tv, audio & cameras",All Electronics,4.3,108.0,120.0
"SupCares Edge to Edge Tempered Glass for iPhone 14, iPhone 13 and 13 Pro (6.1 Inch) with Easy Self Installation Kit | Black","tv, audio & cameras",All Electronics,4.4,289.0,799.0
"QOCXRRIN USB Type C OTG Adapter USB Mouse, Pendrive Connector & 2in1 OTG Adapter, USB 3.0 Female to Micro-USBConnector Alu...","tv, audio & cameras",All Electronics,3.8,99.0,799.0
SYGA Headphones EarPads Cushions Replacement - Compatible with Bose QuietComfort 15 QC15 QC25 QC2 QC35/ Ae2 Ae2i Ae2w Soun...,"tv, audio & cameras",All Electronics,4.2,449.0,650.0
JetLife Universal Mobile Holder/Pouch-Bag for All Scooters Scooty Activa Jupiter EV's | X1 Model (Navy Blue),"tv, audio & cameras",All Electronics,4.3,399.0,799.0
CROSSVOLT Compatible for supervooc Dash Warp / 6Amp / 65W / 30W / 20W / Type C Charger Cable | Fast Data Sync Charging Cab...,"tv, audio & cameras",All Electronics,4.1,289.0,999.0
"Portronics Toad 26 Wired Optical Mouse with 1500 DPI, Optical Orientation, Click Wheel, 1.35M Cable Length(Black)","tv, audio & cameras",All Electronics,3.8,149.0,399.0
"JGD PRODUCTS USB 2.0 A to 5 pin Mini USB B Cable for External HDDS/Camera/Card Readers, etc (33 CM)","tv, audio & cameras",All Electronics,4.2,149.0,699.0
"Xiaomi Wired in-Ear Earphones with Mic, Ultra Deep Bass & Metal Sound Chamber (Red)","tv, audio & cameras",All Electronics,4.1,499.0,999.0
Pikkme Samsung Galaxy M31 / F41 / M31 Prime Flip Cover Case | Leather flip Back Covers Cases for Samsung Galaxy M31 / F41...,"tv, audio & cameras",All Electronics,4.1,299.0,399.0
TheGiftKart Crystal Clear Back Cover Case for Samsung Galaxy M33 5G | 360 Degree Protection | Shock Proof Design | Transpa...,"tv, audio & cameras",All Electronics,4.2,251.0,999.0
"Wilbeva Cleaner Kit for Airpods Pro 1 2 3 & Headphones Earbuds and Case, Revolutionary Cleaning Pen for Bluetooth Earphone...","tv, audio & cameras",All Electronics,4.3,198.0,999.0
HP V165W 16GB USB Flash Drive,"tv, audio & cameras",All Electronics,4.2,275.0,475.0
Techgadget Wireless USB Bluetooth Music Receiver Adapter for Home Theatre Car Speakers MP3 (N-1215),"tv, audio & cameras",All Electronics,3.1,149.0,499.0
"Ambrane 12W Fast Mobile Charger/Adapter, Multi-Layer Protection, Made in India, BIS Certified, Fast Charging Without Cable...","tv, audio & cameras",All Electronics,3.9,249.0,499.0
"Careflection || Coding/Programming Sticker Decals - Pack of 16 (Vinyl Stickers,Multipurpose use for Walls,Suitcase,Laptop,...","tv, audio & cameras",All Electronics,3.8,150.0,799.0
Amazon Brand - Solimo Back Cover Case for Mi Redmi Note 8 | Compatible for Mi Redmi Note 8 Back Cover Case | 360 Degree Pr...,"tv, audio & cameras",All Electronics,4.2,139.0,299.0
TheGiftKart Sleek Back Cover Case for Vivo V27 / V27 PRO 5G | Slim Fit Protective Design | Ultra Matte Finish | Camera Pro...,"tv, audio & cameras",All Electronics,5.0,229.0,999.0
OUXUS B11 Wireless Neckband Bluetooth EarphoneIn Ear Headset Earbud Portable Headphone Handsfree Sports Running Sweatproof...,"tv, audio & cameras",All Electronics,3.6,209.0,699.0
Aster 3+3 Universal Multi Plug Socket Extension Board / Power Adapter with Individual Switches and Fuse Protection (White)...,"tv, audio & cameras",All Electronics,3.7,329.0,999.0
"Amkette Hush Pro Acura 2.4 Ghz Silent Switch Wireless Mouse with Ergonomic Design, High Precision 3 DPI Settings, Smart Au...","tv, audio & cameras",All Electronics,3.4,299.0,699.0
TheGiftKart Crystal Clear Samsung Galaxy S20 FE / S20 FE 5G Back Cover Case | 360 Degree Protection | Shock Proof Design |...,"tv, audio & cameras",All Electronics,4.2,299.0,999.0
"Amazon Brand - Solimo Anti Dust Plug Mobile Cover (Soft & Flexible Back case) for Nothing Phone 1, TPU, Ruddy","tv, audio & cameras",All Electronics,4.4,139.0,499.0
"Printme Silicone Protective Case Cover for OnePlus Nord Buds, Anti Fall Anti Dust, with Hook headphone Case *Case Cover on...","tv, audio & cameras",All Electronics,3.7,269.0,699.0
"A Accessories kart Case for Oneplus 11 5G Case, Crystal Clear Case ipaky Slim Anti Scratch TPU Shockproof Protective Phone...","tv, audio & cameras",All Electronics,3.1,247.0,599.0
"FACTOR NOTES Notebooks Pack of 2: A5 Sized, 90 GSM,288 Pages (144 x 2) Journal Diary(Kraft/Dot Grid)","tv, audio & cameras",All Electronics,4.4,268.0,599.0
"Miracase Upgrade Cover for Airpods Pro 2 2022 Launch Case, Triple Layer Protective Liquid Silicone Case for AirPods Pro 2n...","tv, audio & cameras",All Electronics,3.7,399.0,899.0
"Dyazo Desktop Height Adjustable Foldable Mobile Phone Stand, Stable, Durable Compatible with All Devices Measuring from 4″...","tv, audio & cameras",All Electronics,4.2,449.0,999.0
"Dyazo Ergonomic Mouse Pad, Non-Slip, Anti-Skid, Reversible use, Dual Color, Splash-Proof Suitable for Gaming, Computer, La...","tv, audio & cameras",All Electronics,4.3,199.0,599.0
"Tough Lee (Pack of 2 Tempered Glass Screen Guard Protector for Apple iPhone 14 / Apple iPhone 13, Apple iPhone 13 Pro (Wil...","tv, audio & cameras",All Electronics,4.2,142.0,999.0
Kangaro Stapler HP 45 - Colour May Vary,"tv, audio & cameras",All Electronics,4.4,285.0,300.0
SYGA 5 Pairs Black Replacement Ear Cushion Pads for Sennheiser PX100 Koss,"tv, audio & cameras",All Electronics,3.9,199.0,450.0
Time Office Replacement Cable for Morpho MSO 1300 e/e2/e3 Scanner (Type C) - Black,"tv, audio & cameras",All Electronics,3.8,249.0,499.0
"3M Command, Small Clear Wire Wall Hooks, Up to 225gms, Holds Strongly, Reusable, Adhesive hooks for wall, Multi-surface da...","tv, audio & cameras",All Electronics,3.8,130.0,149.0
"Virtutron 2.4 Amp 2 Port USB Car Charger Adapter Compatible for All Mobile Cellular Phones iPhone X/Xr/Xs/Max/8/7/Plus, Vi...","tv, audio & cameras",All Electronics,5.0,189.0,999.0
Tough Lee Tempered Glass for Apple iPhone 14/13 / 13 Pro (6.1 inch) - Case Friendly Screen Coverage & Earpiece Dust Resist...,"tv, audio & cameras",All Electronics,4.0,142.0,999.0
"Tower Mouth Organ Harmonica 24 Holes Key-C With Scale Change Option, Silver","tv, audio & cameras",All Electronics,4.1,749.0,999.0
"Mobistyle,Luxury Electroplating TPU Case Individual Camera Protection for Each Lens with Logo Cut Design Back Cover Case f...","tv, audio & cameras",All Electronics,3.8,381.0,999.0
Mini Boost Series Splash Proof Nano Bluetooth Speaker for Call and Music (5 watts),"tv, audio & cameras",All Electronics,3.6,359.0,999.0
Tough Lee Tempered Glass Screen Guard for Samsung Galaxy Tab A8 10.5 inch (2022) (SM-X200NZSEINU) (Pack of 1) (WILL NOT FI...,"tv, audio & cameras",All Electronics,4.1,331.0,999.0
Amazon Brand - Solimo Back Cover Case for Realme X2 / Realme XT | Compatible for Realme X2 / Realme XT Back Cover Case | 3...,"tv, audio & cameras",All Electronics,3.9,139.0,299.0
"RPM Euro Games Pubg Gaming for Mobile Gaming. Works with BGMI, CODM & Other Shooting Games","tv, audio & cameras",All Electronics,3.6,219.0,890.0
"Doodle Writing Tomorrow Today Small PU Leather Soft Cover Pocket Size Corporate Executive Diary Notebook (80 GSM, 192 Sing...","tv, audio & cameras",All Electronics,3.9,266.0,445.0
Sounce Replacement Band Strap for Xiaomi Mi Band 2 / Xiaomi MI Band HRX Edition/Xiaomi Mi Band HRX Version (Device not Inc...,"tv, audio & cameras",All Electronics,3.1,99.0,999.0
LN MART Compatible with Xiaomi Mi Watch Lite Strap Sports Smart Accessory Compatible with Redmi Watch Band Bracelet Compat...,"tv, audio & cameras",All Electronics,3.6,299.0,999.0
OpenTech® Tempered Glass Screen Protector Compatible for Samsung Galaxy S20 FE 5G (Transparent) Full Screen Coverage (Exce...,"tv, audio & cameras",All Electronics,4.0,249.0,999.0
"upReale Professional 10"" inch LED Ring Light with 7 Ft Tripod Stand Combo | 3 color modes Dimmable | Lighting For Tiktok Y...","tv, audio & cameras",All Electronics,3.8,849.0,879.0
"Sounce Case Silicone Cover, Compatible with Keychain for Oneplus Nord Buds Full Protection Shockproof Case Cover Anti Fall...","tv, audio & cameras",All Electronics,4.2,190.0,999.0
"HUMBLE Silicone 19mm Replacement Band Strap with Metal Buckle Compatible with Noise Colorfit Pro 2 , Storm Smart Watch & W...","tv, audio & cameras",All Electronics,3.9,266.0,599.0
TheGiftKart Crystal Clear Back Cover Case for Samsung Galaxy M33 5G | 360 Degree Protection | Shock Proof Design | Transpa...,"tv, audio & cameras",All Electronics,4.2,279.0,999.0
"Gizga Essentials Earphone Earpod Cleaning Pen, AirPod, Earbuds, Headphones, Wireless Earphones, 3-in-1 Multifunctional Cle...","tv, audio & cameras",All Electronics,3.9,199.0,599.0
"Amazon Brand - Solimo in Ear Wired Earphones with Mic, 9mm Driver, Gold Plated Jack, Angular Ear Hooks (Black)","tv, audio & cameras",All Electronics,3.1,109.0,119.0
Faber-Castell Water Color Pencils with Paint Brush - Pack of 24 (Assorted),"tv, audio & cameras",All Electronics,4.4,269.0,275.0
INEFABLE Mi Band 5 and 6 Strap Original Band Strap M5/M6 - Pack of 1 - Wine - (Device Not Included - Not Compatible with M...,"tv, audio & cameras",All Electronics,4.0,99.0,399.0
"AmazonBasics HAMA299068 RJ45 Cat-5e Ethernet Patch/LAN Cable for Router (14 Feet/4.26 Meters, White)","tv, audio & cameras",All Electronics,4.3,229.0,600.0
Faber-Castell Triangular Colour Pencils - Pack of 12 (Assorted),"tv, audio & cameras",All Electronics,4.3,98.0,100.0
Eveready 1015 Carbon Zinc AA Batteries - 20 Pieces,"tv, audio & cameras",All Electronics,4.4,299.0,360.0
"Parker Frontier Matte Black GT Roller Ball Pen, Golden color, 1 Count (Pack of 1) (9000020439)","tv, audio & cameras",All Electronics,4.3,697.0,775.0
"BOBO Non-Toxic TPU and Plastic Universal Waterproof Pouch (XL 2021 Model) Cellphone Dry Bag Case for iPhone, Samsung, Pixe...","tv, audio & cameras",All Electronics,4.1,299.0,999.0
"DishanKart A3 120GSM Sketch Book/Artist Pad/Drawing Note Book 50 Sheets 100 Pages for Students, Artists for Painting, Acry...","tv, audio & cameras",All Electronics,4.3,469.0,799.0
TheGiftKart Shockproof Crystal Clear Back Cover Case for OnePlus 5 | 360 Degree Protection | Protective Design | Transpare...,"tv, audio & cameras",All Electronics,4.5,279.0,999.0
"BITZAG M i Smart Watch D116 Bluetooth Smart Watch Touch Screen Bluetooth SmartWatch with Activity Tracker, Heart Rate Sens...","tv, audio & cameras",All Electronics,3.7,409.0,999.0
Amozo Frameless Ultra Slim Flexible Back Case Cover for iPhone 12 / iPhone 12 Pro (Polycarbonate | Black),"tv, audio & cameras",All Electronics,5.0,299.0,999.0
Hanumex® 8x10 FT Premium Professional Chroma Green Background Wrinkle Free for Photo & Video Backdrop Chromakey Screen Bac...,"tv, audio & cameras",All Electronics,3.9,379.0,899.0
"BLAXSTOC DC-787 Foldable Mobile Tabletop Stand Adjustable Phone Holder and iPad Stand & For Bed , Table, Office, Video Rec...","tv, audio & cameras",All Electronics,3.8,99.0,599.0
LOHAYA Remote Compatible for Onida Split/Window AC Remote Control (Onida AC Remote Control) (AC-18),"tv, audio & cameras",All Electronics,3.6,379.05,999.0
"Night Light Bluetooth Speaker Wireless - RAGZAN Portable Smart Touch Control Bedside Table Lamp with Colorful Led, Best Gi...","tv, audio & cameras",All Electronics,3.8,384.0,899.0
TheGiftKart Crystal Clear Back Cover Case for Mi Redmi K20 / K20 Pro | 360 Degree Protection | Shock Proof Design | Transp...,"tv, audio & cameras",All Electronics,4.2,284.0,999.0
"POPIO Screen Guard Protector Compatible for Apple Watch Series 4, 5, 6, Watch SE & Watch SE 2022, 40mm (Transparent) with ...","tv, audio & cameras",All Electronics,3.8,150.0,599.0
OpenTech® Tempered Glass Screen Protector Compatible for Samsung Galaxy M31s / A51 / A52 / A52s / A52 5G with Easy Install...,"tv, audio & cameras",All Electronics,4.0,249.0,999.0
"Yantralay School Of Gadgets 3-Way Monopod Grip Tripod Foldable Selfie Stick Compatible with Go Pro Hero 11/10/9/8,DJI OSM...","tv, audio & cameras",All Electronics,3.9,499.0,899.0
MAHABIR Digital Meter Screen Protector Guard Compatible for Scooter 450X & 450 Plus,"tv, audio & cameras",All Electronics,3.6,199.0,699.0
Parker Frontier GT Fountain Pen,"tv, audio & cameras",All Electronics,4.1,697.0,775.0
Pikkme Leather Magnetic Vintage Flip Wallet Case Cover for Vivo Y12 / Y15 / Y17 / U10 (Blue),"tv, audio & cameras",All Electronics,4.0,199.0,999.0
AGARO 5.4 A USB Dual Port Quick Car Charger (Qualcomm Certified) for All Smartphones & Tablets - Grey,"tv, audio & cameras",All Electronics,3.7,200.0,895.0
TheGiftKart Ultra Clear Slim Anti-Slip Grip Soft Silicone Back Cover Case with Complete Camera Protection & Anti-Dust Plug...,"tv, audio & cameras",All Electronics,4.3,199.0,999.0
"Tizum Earphone Carrying Case - Multi Purpose Pocket Storage with Carabinr Hook, Travel Organizer for Earphones, Pen Drive...","tv, audio & cameras",All Electronics,4.3,229.0,699.0
Amazon Brand - Solimo Back Cover Case for Mi Redmi Note 7 / Redmi Note 7 Pro / Redmi Note 7s | Compatible for Mi Redmi Not...,"tv, audio & cameras",All Electronics,3.8,139.0,299.0
TheGiftKart Shockproof Crystal Clear Back Cover Case for OnePlus 6 | 360 Degree Protection | Protective Design | Transpare...,"tv, audio & cameras",All Electronics,4.2,284.0,999.0
CEDO Clear Case for iPhone Xs Max | Soft Flexible Full Protection Shock Proof TPU Back Cover for iPhone Xs Max (Transparent),"tv, audio & cameras",All Electronics,4.1,199.0,999.0
D'Addario EJ11 12-53 Bronze Light Acoustic Guitar Strings,"tv, audio & cameras",All Electronics,4.4,555.0,620.0
"Panasonic Evolta AA Alkaline Batteries,20 Times Longer Lasting Than Standard zinc Carbon Batteries,Anti-Leak Seal,Protects...","tv, audio & cameras",All Electronics,4.3,140.0,200.0
TheGiftKart Ultra-Hybrid Crystal Clear Back Cover Case for iPhone 14 PRO | Slim Fit Shockproof Design | Camera Protection ...,"tv, audio & cameras",All Electronics,4.6,399.0,999.0
Amazon Brand - Solimo 360 Degree Protection Bumper Protective Design Shockproof Crystal Clear Transparent Back Cover Case ...,"tv, audio & cameras",All Electronics,3.7,159.0,499.0
Electvision Remote Control for led Compatible with Kodak/Thomson Smart led tv (Without Voice) Before Placing Order for ver...,"tv, audio & cameras",All Electronics,3.9,339.0,999.0
"Basesailor for Mi Smart LED TV 4A Remote Control (32""/43"")","tv, audio & cameras",All Electronics,5.0,179.0,999.0
"ELV Wall Mount Mobile Holder, Mobile Stand for All Smartphones with Strong Adhesive Strips, Compatible with iPhone, Smartp...","tv, audio & cameras",All Electronics,4.3,89.0,299.0
1 Year OneAssist Extended Warranty Plan for Mixer Juicer Grinder (5000 to 7500) - Delivery via Email,"tv, audio & cameras",All Electronics,4.1,239.0,349.0
"boAt Micro USB 550 Stress Resistant, Tangle-Free, Sturdy Cable with 3A Fast Charging & 480mbps Data Transmission, 10000+ B...","tv, audio & cameras",All Electronics,4.1,399.0,999.0
"Storite 4 in 1 Professional Screen Cleaning Kit (100ML) for Laptops, Mobiles, LCD, LED, Computers, TV KCL-1025 (Includes C...","tv, audio & cameras",All Electronics,4.2,379.0,999.0
"Zebronics 200HB USB 3.0 4 Port hub with Hi Speed Data Transfer, Aluminum + ABS Body, 15cm Cable, Sleek Design and Plug Pla...","tv, audio & cameras",All Electronics,4.1,399.0,999.0
TRONA Foldable Bed Study Table Portable Multifunction Laptop-Table Lapdesk for Children Bed Foldabe Table Work Office Home...,"tv, audio & cameras",All Electronics,3.9,279.0,699.0
OpenTech® Tempered Glass Screen Protector Compatible for Samsung Galaxy M32 / F22 / A32 / A31 Edge to Edge Coverage with E...,"tv, audio & cameras",All Electronics,4.0,299.0,999.0
QOCXRRIN 360 Degree Rotation Mini Tripod Support Stand for DSLR and Smartphones - Foldable Shockproof Lightweight Bracket ...,"tv, audio & cameras",All Electronics,3.0,99.0,999.0
"ONE ASSIST Live Uninterrupted 1 Year Extended Warranty Plan for Air Cooler 10001 to 15000 - Email Delivery, No Physical Kit","tv, audio & cameras",All Electronics,3.7,309.0,449.0
"Sounce Adjustable Air Vent Mobile Phone Holder for Car with 360° Rotational, Quick Release Button, Compatible with All Sma...","tv, audio & cameras",All Electronics,3.8,299.0,999.0
