nombre,categoria,sub_categoria,calificacion,precio_descuento,precio_actual
boAt BassHeads 100 in-Ear Wired Headphones with Mic (Black),"tv, audio & cameras",All Electronics,4.1,399.0,999.0
Lapster 5-in-1 Multi-Function Laptop Cleaning Brush/Keyboard Cleaning kit/Gadget Cleaning kit Gap Duster Key-Cap Puller fo...,"tv, audio & cameras",All Electronics,4.2,97.0,999.0
SanDisk Cruzer Blade 32GB USB Flash Drive,"tv, audio & cameras",All Electronics,4.3,278.0,650.0
"Portronics Toad 23 Wireless Optical Mouse with 2.4GHz, USB Nano Dongle, Optical Orientation, Click Wheel, Adjustable DPI(B...","tv, audio & cameras",All Electronics,4.1,299.0,599.0
"ZEBRONICS Zeb-Bro in Ear Wired Earphones with Mic, 3.5mm Audio Jack, 10mm Drivers, Phone/Tablet Compatible(Black)","tv, audio & cameras",All Electronics,3.5,149.0,399.0
boAt Bassheads 220 Wired in Ear Earphones(Black Indi),"tv, audio & cameras",All Electronics,4.1,399.0,999.0
"JK Copier Paper - A4, 75 GSM, 1 Ream, 500 Sheets","tv, audio & cameras",All Electronics,4.3,349.0,375.0
"Scotch Double Sided Heavy Duty Tape(1m holds 4.5Kgs) for indoor hanging applications (Photo frames, Mirrors, Key Holders, ...","tv, audio & cameras",All Electronics,3.9,144.0,165.0
"STRIFF Mpad Mouse Mat 230X190X3mm Gaming Mouse Pad, Non-Slip Rubber Base, Waterproof Surface, Premium-Textured, Compatible...","tv, audio & cameras",All Electronics,4.3,99.0,999.0
LAPSTER Spiral Charger Spiral Charger Cable Protectors for Wires Data Cable Saver Charging Cord Protective Cable Cover Set...,"tv, audio & cameras",All Electronics,4.1,81.0,999.0
"Duracell Alkaline AAA Batteries, Pack of 10","tv, audio & cameras",All Electronics,4.4,188.0,220.0
"boAt Type C A325 Tangle-free, Sturdy Type C Cable with 3A Rapid Charging & 480mbps Data Transmission(Black)","tv, audio & cameras",All Electronics,4.1,199.0,499.0
"Logitech B170 Wireless Mouse, 2.4 GHz with USB Nano Receiver, Optical Tracking, 12-Months Battery Life, Ambidextrous, PC/M...","tv, audio & cameras",All Electronics,4.4,595.0,895.0
"GM 3060 E-Book 4 + 1 Power Strip 240 Volts with Master Switch, Indicator, Safety Shutter & 4 International sockets, Red & ...","tv, audio & cameras",All Electronics,4.5,535.0,590.0
"OneAssist 1 Year Extended Warranty for Smartwatch up to 3000 - Email Delivery Within 2 Hours, No Physical Kit","tv, audio & cameras",All Electronics,4.0,59.0,138.0
"HP X1000 Wired USB Mouse with 3 Handy Buttons, Fast-Moving Scroll Wheel and Optical Sensor works on most Surfaces, 3 years...","tv, audio & cameras",All Electronics,4.3,349.0,649.0
"ZEBRONICS Zeb-Bro in Ear Wired Earphones with Mic, 3.5mm Audio Jack, 10mm Drivers, Phone/Tablet Compatible(Green)","tv, audio & cameras",All Electronics,3.5,149.0,399.0
boAt BassHeads 220 Wired in Ear Earphones with Inline Mic(Black),"tv, audio & cameras",All Electronics,4.1,399.0,999.0
"ZEBRONICS Zeb-Bro in Ear Wired Earphones with Mic, 3.5mm Audio Jack, 10mm Drivers, Phone/Tablet Compatible(Blue)","tv, audio & cameras",All Electronics,3.5,149.0,399.0
"Dell MS116 1000Dpi USB Wired Optical Mouse, Led Tracking, Scrolling Wheel, Plug and Play.","tv, audio & cameras",All Electronics,4.5,299.0,650.0
"SanDisk Ultra microSD UHS-I Card 32GB, 120MB/s R","tv, audio & cameras",All Electronics,4.4,369.0,700.0
"Portronics Konnect L 1.2M Fast Charging 3A 8 Pin USB Cable with Charge & Sync Function for iPhone, iPad (Grey)","tv, audio & cameras",All Electronics,4.2,149.0,399.0
Panasonic CR-2032/5BE Lithium Coin Battery - Pack of 5,"tv, audio & cameras",All Electronics,4.4,200.0,250.0
Portronics MODESK POR-122 Universal Mobile Tabletop Holder (Black),"tv, audio & cameras",All Electronics,4.1,99.0,699.0
"JBL C50HI, Wired in Ear Headphones with Mic, One Button Multi-Function Remote, Lightweight & Comfortable fit (Black)","tv, audio & cameras",All Electronics,3.9,399.0,699.0
boAt bassheads 105 Wired in Ear Earphones with Mic (Green),"tv, audio & cameras",All Electronics,4.0,449.0,999.0
"PIDILITE Fevicryl Acrylic Colours Sunflower Kit (10 Colors x 15 ml) DIY Paint, Rich Pigment, Non-Craking Paint for Canvas,...","tv, audio & cameras",All Electronics,4.4,186.0,225.0
"Duracell USB Type C, 3A Braided Sync & Fast Charging Cable, 3.9 Ft (1.2M), QC 2.0/3.0 Ultra Fast Charging, Compatible with...","tv, audio & cameras",All Electronics,4.3,368.0,699.0
Portronics Konnect L POR-1081 Fast Charging 3A Type-C Cable 1.2Meter with Charge & Sync Function for All Type-C Devices (G...,"tv, audio & cameras",All Electronics,4.3,129.0,339.0
"Ambrane Unbreakable 60W / 3A Fast Charging 1.5m Braided Type C Cable for Smartphones, Tablets, Laptops & other Type C devi...","tv, audio & cameras",All Electronics,4.0,199.0,299.0
"boAt Micro USB 55 Tangle-free, Sturdy Micro USB Cable with 3A Fast Charging & 480mbps Data Transmission (Black)","tv, audio & cameras",All Electronics,4.0,139.0,499.0
"Gizga Essentials Hard Drive Case Shell, 6.35cm/2.5-inch, Portable Storage Organizer Bag for Earphone USB Cable Power Bank ...","tv, audio & cameras",All Electronics,4.5,199.0,599.0
"Sounce Fast Phone Charging Cable & Data Sync USB Cable Compatible for iPhone 13, 12,11, X, 8, 7, 6, 5, iPad Air, Pro, Mini...","tv, audio & cameras",All Electronics,3.9,199.0,999.0
"Mi Type C 3Amp 100cm Fast Charge Cable Black|USB to Type C|Supports Upto 22.5W Fast Charging|Suitable for All Smartphones,...","tv, audio & cameras",All Electronics,4.3,229.0,299.0
boAt Rugged v3 Extra Tough Unbreakable Braided Micro USB Cable 1.5 Meter (Black),"tv, audio & cameras",All Electronics,4.2,299.0,799.0
Syska SSK-EBS-0402 ABS 4 Way Power Strip,"tv, audio & cameras",All Electronics,4.0,449.0,470.0
Agaro Blaze USB 3.0 to USB Type C OTG Adapter,"tv, audio & cameras",All Electronics,4.3,139.0,495.0
"Duracell Ultra Alkaline AA Batteries, pack of 8","tv, audio & cameras",All Electronics,4.5,299.0,315.01
"JK Easy Copier Paper | A4 Size | 70 GSM | 500 Sheets | White Paper, 1 Ream | For Laserjet & Inkjet Printer | Fast Drying |...","tv, audio & cameras",All Electronics,4.3,325.0,345.0
"pTron Solero MB301 3A Micro USB Data & Charging Cable, Made in India, 480Mbps Data Sync, Strong & Durable 1.5-Meter Nylon ...","tv, audio & cameras",All Electronics,3.9,99.0,666.66
Canon PG-47 Ink Cartridge (Black),"tv, audio & cameras",All Electronics,4.2,667.0,702.0
boAt Bassheads 100 in Ear Wired Earphones with Mic(Furious Red),"tv, audio & cameras",All Electronics,4.1,399.0,999.0
realme Buds 2 Neo Wired in Ear Earphones with Mic (Blue),"tv, audio & cameras",All Electronics,4.2,499.0,599.0
GIZGA ESSENTIALS Spiral Charger Cable Protector (Set of 10) (G55),"tv, audio & cameras",All Electronics,4.2,79.0,299.0
"Duracell Ultra Alkaline AA Battery, 4 Pcs","tv, audio & cameras",All Electronics,4.5,160.0,190.0
"Mi Xiaomi 22.5W Fast USB Type C Charger Combo|Compatible for Mobile,Power Banks|Fast Charging|(Adapter + USB to Type C Cab...","tv, audio & cameras",All Electronics,4.2,649.0,999.0
"Portronics Ruffpad 8.5E Re-Writable LCD Writing Pad with Screen 21.5cm (8.5-inch) for Drawing, Playing, Handwriting Gifts ...","tv, audio & cameras",All Electronics,4.0,199.0,799.0
"Havells 240V 6A Four-Way 1440W Extension Board With Wire (White)- 1.5 Metre Cable, 10 Volt, 4 Universal sockets with Maste...","tv, audio & cameras",All Electronics,4.3,425.0,708.0
"STRIFF Laptop Tabletop Stand, Fold-Up, Adjustable, Ventilated, Portable Holder For Desk, Aluminum Foldable Laptop Ergonomi...","tv, audio & cameras",All Electronics,4.1,449.0,999.0
"JBL C50HI, Wired in Ear Headphones with Mic, One Button Multi-Function Remote, Lightweight & Comfortable fit (Blue)","tv, audio & cameras",All Electronics,3.9,399.0,999.0
"Beetel B26 Corded Slim Landline Phone,Ringer Volume Control,Wall/Desk Mountable,Ringer On/Off Switch,Clear Call Quality,Co...","tv, audio & cameras",All Electronics,3.9,549.0,749.0
"SWAPKART Flexible Mobile Tabletop Stand, Metal Built, Heavy Duty Foldable Lazy Bracket Clip Mount Multi Angle Clamp for Al...","tv, audio & cameras",All Electronics,3.8,251.0,999.0
"STRIFF Multi Angle Mobile Tabletop Stand. Phone Holder for iPhone, Android, Samsung, OnePlus, Xiaomi. Portable,Foldable Ce...","tv, audio & cameras",All Electronics,4.3,119.0,499.0
Zebronics Zeb-Companion 107 USB Wireless Keyboard and Mouse Set with Nano Receiver (Black),"tv, audio & cameras",All Electronics,3.5,699.0,999.0
Lapster USB all types smartwatch charger cable for boat watch charger & boat xtend watch charger & boat storm watch charge...,"tv, audio & cameras",All Electronics,3.4,113.0,999.0
boAt Bassheads 105 Wired in Ear Earphones with Mic (Black),"tv, audio & cameras",All Electronics,4.0,449.0,999.0
Eveready 1015 Carbon Zinc AA Battery - 10 Pieces,"tv, audio & cameras",All Electronics,4.4,149.0,180.0
Boult Audio BassBuds X1 in-Ear Wired Earphones with 10mm Extra Bass Driver and HD Sound with mic(Blue),"tv, audio & cameras",All Electronics,3.9,329.0,999.0
Boult Audio BassBuds X1 in-Ear Wired Earphones with 10mm Extra Bass Driver and HD Sound with mic(Black),"tv, audio & cameras",All Electronics,3.9,329.0,999.0
Zebronics Zeb-Transformer-M Optical USB Gaming Mouse with LED Effect(Black),"tv, audio & cameras",All Electronics,4.3,399.0,549.0
"Zebronics ZEB-90HB USB Hub, 4 Ports, Pocket Sized, Plug & Play, for Laptop & Computers","tv, audio & cameras",All Electronics,3.4,179.0,499.0
"Gizga Essentials Professional 3-in-1 Cleaning Kit for Camera, Lens, Binocular, Laptop, TV, Monitor, Smartphone, Tablet (In...","tv, audio & cameras",All Electronics,4.2,249.0,499.0
"HP 150 Wireless USB Mouse with Ergonomic and ambidextrous Design, 1600 DPI Optical Tracking, 2.4 GHz Wireless connectivit...","tv, audio & cameras",All Electronics,4.0,549.0,899.0
"Zebronics ZEB-COUNTY 3W Wireless Bluetooth Portable Speaker With Supporting Carry Handle, USB, SD Card, AUX, FM & Call Fun...","tv, audio & cameras",All Electronics,3.9,499.0,999.0
Inefable ( 12 Pcs ) Multicoloured Protection Spiral Cable & Wire Protectors Spring Wire for All Wired Accessories for USB ...,"tv, audio & cameras",All Electronics,3.8,79.0,399.0
Duracell Chhota Power AA Battery Set of 10 Pcs,"tv, audio & cameras",All Electronics,4.4,188.0,220.0
"tizum HDMI to VGA Adapter/ Connector/ Converter Cable 1080P (Male to Female) for Media Players, Xbox, Projector, Computer,...","tv, audio & cameras",All Electronics,3.7,259.0,499.0
"Lenovo 300 Wired Plug & Play USB Mouse, High Resolution 1600 DPI Optical Sensor, 3-Button Design with clickable Scroll Whe...","tv, audio & cameras",All Electronics,4.4,284.0,590.0
"TP-Link USB WiFi Adapter for PC(TL-WN725N), N150 Wireless Network Adapter for Desktop - Nano Size WiFi Dongle Compatible w...","tv, audio & cameras",All Electronics,4.2,499.0,999.0
"LAPSTER 12pcs Spiral Cable Protectors for Charger, Wires, Data Charger Cable Protector for Computers, Cell Phones etc.(Grey)","tv, audio & cameras",All Electronics,4.2,70.0,999.0
"TP-Link USB Bluetooth Adapter for PC, 5.0 Bluetooth Dongle Receiver (UB500) Supports Windows 11/10/8.1/7 for Desktop, Lapt...","tv, audio & cameras",All Electronics,4.3,599.0,899.0
Tizum Mouse Pad - Computer Mouse Mat with Anti-Slip Rubber Base & Smooth Mouse Control with Spill-Resistant Surface for La...,"tv, audio & cameras",All Electronics,4.4,149.0,299.0
"Omron MC 246 Digital Thermometer With Quick Measurement of Oral & Underarm Temperature in Celsius & Fahrenheit, Water Resi...","tv, audio & cameras",All Electronics,4.1,239.0,275.0
SUPER TOY 8.5 Inch LCD Writing Tablet E-Notepad Ruff Pad (Multicolor),"tv, audio & cameras",All Electronics,3.8,249.0,799.0
Epson 003 65 ml for EcoTank L1110/L3100/L3101/L3110/L3115/L3116/L3150/L3151/L3152/L3156/L5190 Black Ink Bottle,"tv, audio & cameras",All Electronics,4.4,309.0,404.0
"DIGITEK® (DTR 260 GT) Gorilla Tripod/Mini 33 CM (13 Inch) Tripod for Mobile Phone with Phone Mount & Remote, Flexible Gori...","tv, audio & cameras",All Electronics,3.9,399.0,995.0
Sounce Shutter Remote Control with Bluetooth Wireless Technology - Create Amazing Photos and Videos Hands-Free - Works wit...,"tv, audio & cameras",All Electronics,4.4,169.0,999.0
"Ambrane Mobile Holding Tabletop Stand, 180 Perfect View, Height Adjustment, Wide Compatibility, Multipurpose, Anti-Skid De...","tv, audio & cameras",All Electronics,4.2,199.0,499.0
"Ambrane 60W / 3A Type C Fast Charging Unbreakable 1.5m L Shaped Braided Cable, PD Technology, 480Mbps Data Transfer for Sm...","tv, audio & cameras",All Electronics,4.0,199.0,499.0
"Lapster USB all types smartwatch charger cable for Boat Xtend,boat storm, W26 W26+ W26m W55+, Noise ColorFit Pulse, Colorf...","tv, audio & cameras",All Electronics,3.7,178.0,999.0
Duracell Plus AAA Rechargeable Batteries (750 mAh) Pack of 4,"tv, audio & cameras",All Electronics,4.3,399.0,499.0
boAt Bassheads 100 Wired in Ear Earphones with Mic (Mint Green),"tv, audio & cameras",All Electronics,4.1,399.0,999.0
"ZEBRONICS Zeb-Dash Plus 2.4GHz High Precision Wireless Mouse with up to 1600 DPI, Power Saving Mode, Nano Receiver and Plu...","tv, audio & cameras",All Electronics,3.5,299.0,449.0
"Xiaomi Wired in-Ear Earphones with Mic, Ultra Deep Bass & Metal Sound Chamber (Black)","tv, audio & cameras",All Electronics,4.1,499.0,599.0
Cello Bling Pastel Ball Pen | Blue Ball Pen | Jar of 25 Units | Best Ball Pens for Smooth Writing | Ball Point Pen Set | P...,"tv, audio & cameras",All Electronics,4.0,125.0,150.0
Logitech H111 Wired On Ear Headphones With Mic Black,"tv, audio & cameras",All Electronics,4.0,745.0,795.0
AmazonBasics AAA Performance Alkaline Non-Rechargeable Batteries (8-Pack) - Appearance May Vary,"tv, audio & cameras",All Electronics,4.2,159.0,295.0
HP Wireless Mouse 250/2.4 GHz Wireless USB connectivity/12 Months Battery Life/LED Optical Sensor/ 1600 DPI/3 Years Warran...,"tv, audio & cameras",All Electronics,4.3,699.0,999.0
Goldmedal Curve Plus 202042 Plastic Spice 3-Pin 240V Universal Travel Adaptor (White),"tv, audio & cameras",All Electronics,4.5,99.0,171.0
Sounce Spiral Charger Cable Protector Data Cable Saver Charging Cord Protective Cable Cover Headphone MacBook Laptop Earph...,"tv, audio & cameras",All Electronics,4.1,99.0,999.0
"Logitech B100 Wired USB Mouse, 3 yr Warranty, 800 DPI Optical Tracking, Ambidextrous PC/Mac/Laptop - Black","tv, audio & cameras",All Electronics,4.3,269.0,375.0
"USB Charger, Oraimo Elite Dual Port 5V/2.4A Wall Charger, USB Wall Charger Adapter for iPhone 11/Xs/XS Max/XR/X/8/7/6/Plu...","tv, audio & cameras",All Electronics,4.0,249.0,649.0
Zodo 8. 5 inch LCD E-Writer Electronic Writing Pad/Tablet Drawing Board (Paperless Memo Digital Tablet),"tv, audio & cameras",All Electronics,3.6,150.0,399.0
"Juarez JRZ250 One Handed Trigger Guitar Metal Capo Quick Change For Ukulele, Electric And Acoustic Guitars, Black","tv, audio & cameras",All Electronics,4.3,130.0,990.0
HP 680 Tri-color Original Ink Advantage Cartridge,"tv, audio & cameras",All Electronics,4.2,758.0,886.0
boAt Bassheads 220 Wired in Ear Earphones(Indi Lime),"tv, audio & cameras",All Electronics,4.1,399.0,999.0
"Portronics Clamp M2 Adjustable Car Mobile Phone Holder Stand, 360° Rotational, Strong Suction Cup, Compatible with 4 to 6 ...","tv, audio & cameras",All Electronics,4.1,649.0,899.0
"STRIFF Webcam Cover Slide, Ultra Thin Laptop Camera Cover Slide Blocker for Computer MacBook Pro iMac PC Tablet (Pack of ...","tv, audio & cameras",All Electronics,4.2,79.0,499.0
MYVN WARP/Dash Charging Type c Charging Adapter Cable Compatible for One Plus 8T 8 8pro 7 Pro / 7T / 7T Pro Nord and Dash ...,"tv, audio & cameras",All Electronics,4.1,329.0,999.0
Syska 4 Way Power Plug Adapter (White) (1),"tv, audio & cameras",All Electronics,4.2,207.0,225.0
"Amazon Basics Magic Slate 8.5-inch LCD Writing Tablet with Stylus Pen, for Drawing, Playing, Noting by Kids & Adults, Black","tv, audio & cameras",All Electronics,4.0,309.0,999.0
Onsitego 1 year Extended Warranty for Small Appliances up to Rs 2500 (Email Delivery - No Physical Kit),"tv, audio & cameras",All Electronics,3.9,123.0,397.0
"Elv Foldable, Portable, Tablet / Phone Stand. Compatible Phone Holder for iPhone, Android, Samsung, OnePlus, Xiaomi, Oppo,...","tv, audio & cameras",All Electronics,4.1,79.0,499.0
"Ambrane Unbreakable 60W / 3A Fast Charging 1.5m Braided Type C to Type C Cable for Smartphones, Tablets, Laptops & Other T...","tv, audio & cameras",All Electronics,4.0,199.0,299.0
"Pidilite Rangeela Holi Ke Rang - 4 Fluorescent Shades of Holi Colours (Floro Pink, Floro Yellow, Floro Orange, Floro Gree...","tv, audio & cameras",All Electronics,4.2,99.0,160.0
"Samsung Original EHS64 Wired in Ear Earphones with Mic, Black","tv, audio & cameras",All Electronics,4.2,449.0,499.0
"Redgear A-10 Wired Gaming Mouse with RGB LED, Lightweight and Durable Design, DPI Upto 2400, Compatible with Windows and MAC.","tv, audio & cameras",All Electronics,4.3,199.0,699.0
"Classmate Long Notebook - 140 Pages, Single Line, 297Mm X 210Mm (Pack Of 12)","tv, audio & cameras",All Electronics,4.4,549.0,720.0
Zebronics ZEB-KM2100 Multimedia USB Keyboard Comes with 114 Keys Including 12 Dedicated Multimedia Keys & with Rupee Key,"tv, audio & cameras",All Electronics,3.6,329.0,399.0
SanDisk Cruzer Blade SDCZ50-016G-135 16 GB USB 2.0 Pen Drive (Red),"tv, audio & cameras",All Electronics,4.2,259.0,450.0
Sounce USB 3.0 to Type-C OTG Cable Male-Female Adapter Compatible with All C Type Supported Mobile Smartphone and Other De...,"tv, audio & cameras",All Electronics,4.0,129.0,499.0
TECHONTO 360° Degree Cell Phone Holder with Adjustable Clamp Phone Tripod Mount Adapter Compatible with Smartphones & All ...,"tv, audio & cameras",All Electronics,4.3,195.0,699.0
boAt Dual Port Rapid Car Charger (Qualcomm Certified) with Quick Charge 3.0 + Free Micro USB Cable - (Black),"tv, audio & cameras",All Electronics,4.3,449.0,999.0
"Classmate Soft Cover 6 Subject Spiral Binding Notebook, Single Line, 300 Pages","tv, audio & cameras",All Electronics,4.5,149.0,175.0
SUPER TOY Multicolor LCD Graphic Writing Tablet 8.5Inch E-Note Pad Best Birthday Gift for Kids Boys Girls,"tv, audio & cameras",All Electronics,4.5,225.0,799.0
"pTron Solero M241 2.4A Micro USB Data & Charging Cable, Made in India, 480Mbps Data Sync, Durable 1-Meter Long USB Cable f...","tv, audio & cameras",All Electronics,3.9,89.0,800.0
boAt BassHeads 100 in-Ear Wired Headphones with Mic (White),"tv, audio & cameras",All Electronics,4.1,399.0,999.0
"pTron Pride Lite HBE (High Bass Earphones) in Ear Wired Earphones with Mic, 10mm Powerful Driver for Stereo Audio, Noise C...","tv, audio & cameras",All Electronics,3.6,199.0,749.17
"Kratos Thump Wired Earphones, Powerful Bass, HD Sound Quality Earphones, Tangle Free Cable, Comfortable in Ear Fit, with m...","tv, audio & cameras",All Electronics,3.2,99.0,599.0
COI Note Pad/Memo Book with Sticky Notes & Clip Holder with Pen for Gifting,"tv, audio & cameras",All Electronics,4.1,198.0,800.0
"Portronics CarPower Mini Car Charger with Dual Output, Fast Charging (Type C PD 18W + QC 3.0A) Compatible with All Smartph...","tv, audio & cameras",All Electronics,4.2,383.0,699.0
Cello Signature Carbon Ball Pen | Blue Ball Pen | Pack of 1 | Premium Ball Pens | Best Ball Pen for Smooth Writing | Gifti...,"tv, audio & cameras",All Electronics,4.3,135.0,200.0
HP 678 Black Ink Advantage Cartridge (CZ107AA),"tv, audio & cameras",All Electronics,4.1,810.0,850.0
"Zebronics Zeb-Power Wired USB Mouse, 3-Button, 1200 DPI Optical Sensor, Plug & Play, for Windows/Mac","tv, audio & cameras",All Electronics,4.0,149.0,249.0
"pTron Pride Lite HBE (High Bass Earphones) in Ear Wired Earphones with Mic, 10mm Powerful Driver for Stereo Audio, Noise C...","tv, audio & cameras",All Electronics,3.6,199.0,899.0
"Ambrane Wired in Ear Earphones with in-line Mic for Clear Calling, 14mm Dynamic Drivers for BoostedBass, 3.5mm Jack, Mult...","tv, audio & cameras",All Electronics,3.7,299.0,449.0
"3M Post-it Sticky Note Cube, 200 Sheets (4 Colors x 50 Sheets) | 3"" x 3"" Size | For notes, reminders, study, school and or...","tv, audio & cameras",All Electronics,4.4,124.0,135.0
"Mivi Rock and Roll E5 Wired In Ear Earphones with HD Sound and Extra Powerful Bass with Mic, Tangle Free & Extra Length Ca...","tv, audio & cameras",All Electronics,3.9,299.0,799.0
Portronics MPORT 31C 4-in-1 USB Hub (Type C to 4 USB-A Ports) with Fast Data Transfer,"tv, audio & cameras",All Electronics,4.2,499.0,999.0
"ZEBRONICS Zeb-Comfort Wired USB Mouse, 3-Button, 1000 DPI Optical Sensor, Plug & Play, for Windows/Mac, Black","tv, audio & cameras",All Electronics,3.8,139.0,299.0
SanDisk SDCZ48-032G-UAM46 Ultra CZ48 32GB USB 3.0 Pen Drive (Black),"tv, audio & cameras",All Electronics,4.3,338.0,750.0
"MI Type B/Micro USB 120cm fast Charging cable|480mbps support|Suitable for all Smartphones,tablet and accessories with typ...","tv, audio & cameras",All Electronics,4.2,229.0,299.0
"PHILIPS Audio TAE1126 Wired in Ear Earphones with mic, 10 mm Driver, Powerful bass and Clear Sound, Black","tv, audio & cameras",All Electronics,3.9,249.0,699.0
"Ant Esports MP290 Gaming Mouse Pad-L- Large with Stitched Edges, Waterproof Non-Slip Base for Gaming & Office – Black","tv, audio & cameras",All Electronics,4.5,199.0,999.0
Onsitego 1 year Extended Warranty for Small Appliances up to Rs 5000 (Email Delivery - No Physical Kit),"tv, audio & cameras",All Electronics,3.9,161.0,849.0
Zebronics Wired Keyboard and Mouse Combo with 104 Keys and a USB Mouse with 1200 DPI - JUDWAA 750,"tv, audio & cameras",All Electronics,3.9,448.0,549.0
"Ambrane Unbreakable 3 in 1 Fast Charging Braided Multipurpose Cable for Speaker with 2.1 A Speed - 1.25 meter, Black","tv, audio & cameras",All Electronics,4.0,299.0,399.0
CLAVIER Super Bass Type-C in-Ear Earphones with Stereo Mic for All Smartphones with Rich Bass & Noise Cancellation,"tv, audio & cameras",All Electronics,2.9,149.0,599.0
"Amazon Basics High-Speed HDMI Cable - 10 Feet (Latest Standard) - Supports Ethernet, 3D, 4K video,Black","tv, audio & cameras",All Electronics,4.4,379.0,995.0
"Zebronics Zeb-Buds 30 3.5Mm Stereo Wired In Ear Earphones With Mic For Calling, Volume Control, Multifunction Button, 14Mm...","tv, audio & cameras",All Electronics,3.6,199.0,499.0
"Lapster Caddy for ssd and HDD, Optical Bay 2nd Hard Drive Caddy, Caddy 9.5mm for Laptop","tv, audio & cameras",All Electronics,4.2,150.0,999.0
Canon Compatible for Canon GI-790 Ink Bottle (Black),"tv, audio & cameras",All Electronics,4.4,499.0,561.0
"Ambrane Mobile Holding Tabletop Stand, 180 Perfect View, Height Adjustment, Wide Compatibility, Multipurpose, Anti-Skid De...","tv, audio & cameras",All Electronics,4.2,249.0,499.0
"SYSKA PW-0301 Power Wheel - Extension Board, Grey and White, 1500 watt, 240V, 4m Wire","tv, audio & cameras",All Electronics,4.2,269.0,270.0
"Gizga Essentials Earphone Carrying Case, Multi-Purpose Pocket Storage Travel Organizer for Earphones, Headset, Pen Drives,...","tv, audio & cameras",All Electronics,4.3,119.0,499.0
"Beetel B11 Corded Landline Phone, Ringer Volume Control, LED for Ring Indication, Wall/Desk Mountable, Classic Design, Cle...","tv, audio & cameras",All Electronics,3.9,549.0,679.0
"Zebronics ZEB-COUNTY 3W Wireless Bluetooth Portable Speaker With Supporting Carry Handle, USB, SD Card, AUX, FM & Call Fun...","tv, audio & cameras",All Electronics,3.9,549.0,999.0
Canon PG-745s (Small) Ink Cartridge (Black),"tv, audio & cameras",All Electronics,3.9,686.0,722.0
"Sounce Case Silicone Cover, Compatible with Keychain for Oneplus Nord Buds Full Protection Shockproof Case Cover Anti Fall...","tv, audio & cameras",All Electronics,4.2,199.0,999.0
"Duracell Specialty CR2025 Lithium Coin Battery 3V, Pack of 5 Suitable for use in keyfobs, Scales, wearables and Medical De...","tv, audio & cameras",All Electronics,4.4,133.0,200.0
"FACTOR NOTES Notebook: 90 GSM, B6, Ruled, 112 Pages Journal Diary (Little Things in Life)","tv, audio & cameras",All Electronics,4.2,98.0,199.0
Sounce Silicone Adjustable Watch Band Strap For Xiaomi Mi Band 3/ Mi Band 4 (Not Compatible For Mi Band 1/2),"tv, audio & cameras",All Electronics,4.0,149.0,299.0
"Redgear A-15 Wired Gaming Mouse with Upto 6400 DPI, RGB & Driver Customization for PC(Black)","tv, audio & cameras",All Electronics,4.3,499.0,799.0
"AmazonBasics Expanding File Folder, Letter Size (Fits A4 Paper) - Black - with 13 pockets","tv, audio & cameras",All Electronics,4.3,449.0,615.0
"Mi 5V Charger|10W Wall Charger with USB Cable|Compatible for Mobile, Headphones, TWS, Game Console, Power Banks|Fast Charg...","tv, audio & cameras",All Electronics,4.2,499.0,599.0
boAt Bassheads 220 Wired in Ear Earphones(Indi Blue),"tv, audio & cameras",All Electronics,4.1,399.0,999.0
"GIZGA Essentials Portable Tabletop Tablet Stand Mobile Holder, Desktop Stand, Cradle, Dock for iPad, Smartphone, Kindle, ...","tv, audio & cameras",All Electronics,4.1,139.0,499.0
Tizum High Speed HDMI Cable with Ethernet | Supports 3D 4K | for All HDMI Devices Laptop Computer Gaming Console TV Set To...,"tv, audio & cameras",All Electronics,4.2,199.0,699.0
"Kanget [2 Pack] Type C Female to USB A Male Charger | Charging Cable Adapter Converter compatible for iPhone 14, 13, 12,11...","tv, audio & cameras",All Electronics,3.9,149.0,499.0
"AirCase Protective Laptop Bag Sleeve fits Upto 15.6"" Laptop/ MacBook, Wrinkle Free, Padded, Waterproof Light Neoprene case...","tv, audio & cameras",All Electronics,4.3,449.0,999.0
Doubledicestore Tempered Glass Screen Protector Compatible for iPhone XR / 11 with Edge to Edge Coverage and Easy Installa...,"tv, audio & cameras",All Electronics,4.2,149.0,599.0
Quantum QHM6633 4-Port Hi-Speed USB Hub with 480 Mbps Speed (Multicolor),"tv, audio & cameras",All Electronics,3.9,179.0,325.0
Luxor Finewriter Assorted color (Pack of 10 Pen),"tv, audio & cameras",All Electronics,4.3,99.0,120.0
MAONO AU-400 Lavalier Auxiliary Omnidirectional Microphone (Black),"tv, audio & cameras",All Electronics,3.8,489.0,699.0
