nombre,categoria,sub_categoria,calificacion,precio_descuento,precio_actual
Frexcez 5V/4A USB Vooc Flash Power Adapter Cable Wall Charger for Oppo F11 Pro & All Oppo Smartphone -Cable,"tv, audio & cameras",All Electronics,4.1,289.0,999.0
"Pikkme Back Cover for Samsung Galaxy M51 (Thermoplastic Polyurethane, Plastic|Black)","tv, audio & cameras",All Electronics,3.8,199.0,259.0
WOW IMAGINE Slim Ultra Soft Rubberised Back Cover for Samsung Galaxy M33 5G | Inner Velvet Fabric Lining | Matte Silicone ...,"tv, audio & cameras",All Electronics,4.1,259.0,999.0
IRONFIX® (Pack of 4) Cable Protector Data Cable Saver Charging Cord Protective Cable Cover (4pc),"tv, audio & cameras",All Electronics,4.0,60.0,299.0
"Dyazo Mobile Stand Holder for Desk Sturdy, Anti-Slip , Height Angle Adjustable Mobile Holder Cellphone Holder Compatible w...","tv, audio & cameras",All Electronics,4.2,379.0,799.0
"Kabeer Art Mechanical Pencil With Clutch Mechanism For 2B, 4B, 6B, 8B Leads + 6 Lead Refills (4B/5.6mm)","tv, audio & cameras",All Electronics,4.2,331.55,450.0
"TONSY Men's and Women's Universal Watch Battery Cells 364A, 376, 377A, SR626SW, LR626, 377, LR626, AG4, 1.5V Alkaline Butt...","tv, audio & cameras",All Electronics,3.9,199.0,999.0
"Reynolds RACER GEL 20 CT JAR, BLUE Gel Pen I Lightweight Gel Pen With Comfortable Grip for Extra Smooth Writing I School a...","tv, audio & cameras",All Electronics,4.2,230.0,325.0
"IRONFIX® Unbreakable Mobile Holder for Home Wall Charging, Wall Mount Phone Holder, Wall Mobile Charging Holder,Wall Holde...","tv, audio & cameras",All Electronics,4.0,99.0,299.0
Pikkme Mi Redmi 9A / 9i / 9A Sport Back Cover Soft Matte Liquid Silicone TPU | Camera Protection | Shockproof Slim Back Ca...,"tv, audio & cameras",All Electronics,4.2,199.0,999.0
ZEBRONICS Zeb-Tulip Wired in Ear Earphone with Mic (White),"tv, audio & cameras",All Electronics,3.4,149.0,459.0
Generic Home Theater Remote Control compactable for Sony anu156 Model tv,"tv, audio & cameras",All Electronics,3.9,199.0,499.0
WOW IMAGINE Samsung Galaxy M33 5G Flexible Crystal Clear TPU Ultra Protective Back Case Cover - Transparent,"tv, audio & cameras",All Electronics,4.1,199.0,999.0
"BESTOR Right Angle USB C Adapter, 40Gbps USB C Adapter, 90 Degree Type-C Male to Female Adapter, USB C Splitter Adapter Su...","tv, audio & cameras",All Electronics,4.3,249.0,699.0
Skywalk Microfiber Plastic Laptop/Computer/Keyboard Dust Cleaning Brush,"tv, audio & cameras",All Electronics,4.0,189.0,499.0
Pikkme Vivo Y12s / Y20 / Y20i / Y20G Flip Case Leather Finish | Inside TPU with Card Pockets | Wallet Stand and Shock Proo...,"tv, audio & cameras",All Electronics,4.1,199.0,999.0
TheGiftKart Tough Armor Bumper Back Case Cover for iQOO Neo 7 5G | Ring Holder & Kickstand in-Built | 360 Degree Protectio...,"tv, audio & cameras",All Electronics,4.4,299.0,999.0
TheGiftKart Protective Sleek Back Cover Case for Samsung Galaxy M21 / M21 2021 Edition / M30s | Soft TPU Rubberised Matte ...,"tv, audio & cameras",All Electronics,4.1,199.0,999.0
Amozo Back Case Cover for iPhone 13 Pro Max (Polycarbonate|Blue),"tv, audio & cameras",All Electronics,3.9,284.0,999.0
"IRONFIX® Square Earphone case Earphone Pouch | Earphones case | Headphone Pouch |Eearphone Cover, Carrying Case for Earpho...","tv, audio & cameras",All Electronics,3.9,60.0,299.0
TheGiftKart Crystal Clear Back Cover Case for Mi Redmi Note 11T 5G / Poco M4 Pro 5G | 360 Degree Protection | Shock Proof ...,"tv, audio & cameras",All Electronics,4.2,251.0,999.0
Pikkme Mi Redmi 10 / Redmi 10 Power Flip Cover | PU Leather Finish | 360 Protection | Wallet & Stand | Strong Magnetic Fli...,"tv, audio & cameras",All Electronics,4.1,199.0,999.0
WOW IMAGINE Shock Proof Clear Back Cover Case Mobile Cover for 1+ Oneplus Nord 2 5G | OnePlus Nord 2 5G Pac-Man Edition (H...,"tv, audio & cameras",All Electronics,4.2,259.0,999.0
Wayona Type C Nylon Braided Usb C Quick Charger Fast Charging Cable For Tablets Samsung Galaxy S10E/S10+/S10/S9/S9+/Note ...,"tv, audio & cameras",All Electronics,4.3,319.0,999.0
"Epaal Magnetic USB Charging Cable for Charging Adapter Realme Watch 2 & 2 Pro Only (Black, 1 Meter Long)","tv, audio & cameras",All Electronics,3.6,399.0,599.0
TheGiftKart Crystal Clear Back Case Cover for Google Pixel 7 | Shockproof 360 Degree Protection | Camera Protection Bump |...,"tv, audio & cameras",All Electronics,4.3,284.0,999.0
"newtechno Tempered Glass Screen Protector designed for Apple Watch Ultra (49mm), 2 Pack","tv, audio & cameras",All Electronics,3.8,150.0,999.0
"AINE USB C Fast Charging Cable For Lightning To C Type, USB-C Power Delivery Charging Cord for iPhone 14/13/12/12 PRO Max/...","tv, audio & cameras",All Electronics,4.4,459.0,599.0
"Acko 1 Year Extended Warranty for Tablets Between INR 10,001-20,000 (Email Delivery)","tv, audio & cameras",All Electronics,4.0,349.0,799.0
Tombow Zero Pen Type Eraser Round Shape 2.3 mm Tip Mono-Shade with Extra Refill Pack (White),"tv, audio & cameras",All Electronics,4.5,299.0,450.0
TERABYTE HDMI to VGA 1080P HDMI Male to VGA Female Video Converter Adapter Cable for PC Laptop HDTV Projectors and More De...,"tv, audio & cameras",All Electronics,3.7,189.0,899.0
REALCASE Designed for iPhone 14 Back Cover Case | Stylish Frameless Matte Hard Skin | Soft TPU Shock Proof Bumper Back Cov...,"tv, audio & cameras",All Electronics,4.8,348.0,999.0
"Storite HDMI Extender Female to Female Coupler Adapter for HDTV, Laptop PC, Projector - Black (3 Pack)","tv, audio & cameras",All Electronics,4.0,299.0,699.0
"Upix® AC Remote No. 29C, Compatible for Panasonic AC Remote Control (Exactly Same Remote Will Only Work)","tv, audio & cameras",All Electronics,4.2,449.0,899.0
CEDO Clear Case for iPhone 13 Pro | Soft Flexible Full Protection Shock Proof TPU Back Cover for iPhone 13 Pro (Transparent),"tv, audio & cameras",All Electronics,4.1,199.0,999.0
POPIO Tempered Glass Compatible for iPhone 14 Pro Max (Transparent) Edge to Edge Full Screen Coverage with Installation Ki...,"tv, audio & cameras",All Electronics,4.2,150.0,599.0
Contra Premium L21 TWS Earbuds Wireless Earphone Mini Bluetooth 5.0 Truly Sports Over Ear Headphone Waterproof Earbuds HD ...,"tv, audio & cameras",All Electronics,3.7,484.0,599.0
TRONI 'Foldable Bed Study Table Portable Multifunction Laptop-Table Lapdesk for Children Bed Foldabe Table Work Office Hom...,"tv, audio & cameras",All Electronics,3.8,219.0,699.0
"Portronics Toad 27 Wireless Mouse, Silent Buttons, 2.4 GHz with USB Nano Dongle for PC/Mac/Laptop, Auto Power Saving Mode,...","tv, audio & cameras",All Electronics,4.0,389.0,499.0
"Kammateswara LCD Writing Tablet in Kids Slate with 8.5 Inch Screen LCD Writing pad, Writing Tablet Toys for Kids(Multicolor)","tv, audio & cameras",All Electronics,3.8,200.0,490.0
"CodersParadise Pack of 57 Harry Potter Movie Stickers for Laptop, Journal, Diary, Guitar, Mobile Case - Aesthetic Waterpro...","tv, audio & cameras",All Electronics,4.7,299.0,899.0
Sounce Anti Fall Dust Protection Case Cover for Oppo Enco Buds Headphones Case Silicone Headset case with Keychain (Case C...,"tv, audio & cameras",All Electronics,4.3,99.0,999.0
"M.G.R.J® Tempered Glass Screen Protector for Samsung Galaxy Watch 5 / Watch 4 (44mm) (1.4"" inch) (Pack of 2)","tv, audio & cameras",All Electronics,4.2,299.0,999.0
Fast Charger Compatible for Mi Xiaomi Redmi Mi 9/9A/9i/4/4A/5/5A/6A/6 Pro/7 | Smartphone Mobile | Wall | Travel | Adapter/...,"tv, audio & cameras",All Electronics,3.1,325.0,999.0
KABEER ART Sticky Notes 3 x 5 Inch Pad 4 Colors (400 Sheets),"tv, audio & cameras",All Electronics,4.1,285.0,600.0
JULEX IR Security CCTV False Outdoor Camera Fake Dummy Security Camera Realistic Looking Dummy Security CCTV Fake Bullet C...,"tv, audio & cameras",All Electronics,3.9,579.0,999.0
"Zitel® Charger Stand Compatible with Apple Watch Series 7/6/SE/5/4/3/2/1 (45mm, 44mm, 42mm, 41mm, 40mm, 38mm) Nightstand M...","tv, audio & cameras",All Electronics,4.3,389.0,999.0
CEDO Redmi 9/9 Activ Back Cover | Matte Soft Silicon Flexible | Camera Bump Protection | All Side Shock Proof Rubberised B...,"tv, audio & cameras",All Electronics,4.1,149.0,999.0
"Sounce Earphone Cleaning Pen Compatible with AirPods Cleaner Kit, 3-in-1 Earbuds Cleaning kit for AirPods Earphones, Earph...","tv, audio & cameras",All Electronics,4.6,149.0,999.0
"JUDEE Keyboard Cleaning Brush 7 in 1 Kit, Portable Keyboard Tools Including Screen Dust Brush, Airpod Cleaner Per with Key...","tv, audio & cameras",All Electronics,4.3,349.0,599.0
Cosmic Byte Equinox Mousepad Speed Edition (L) (32x27x0.3cms),"tv, audio & cameras",All Electronics,4.4,199.0,349.0
Amazon Brand - Solimo Rubber Soft & Flexible Hybrid Back Phone Case for Samsung Galaxy A50 (Black),"tv, audio & cameras",All Electronics,4.0,139.0,299.0
Cello Signature Origin Ball Pen | Premium Metal Ball Pen | Pack of 1 | Ball Pen Blue | Easy Twist Mechanism |Best Pen for ...,"tv, audio & cameras",All Electronics,4.3,168.0,225.0
"POPIO Camera Lens Protector for iPhone 14 / iPhone 14 Plus (Transparent), Pack of 2","tv, audio & cameras",All Electronics,3.9,251.0,599.0
"Mizi [2 Pack] Metal Anti Dust Plug, Protect Charging Port from Dust and Moist with Storage Box and Cable Clip Holder for i...","tv, audio & cameras",All Electronics,4.0,259.0,499.0
"GIZGA essentials (29cm x 24cm Gaming Mouse Pad, Laptop Desk Mat, Computer Mouse Pad with Smooth Mouse Control, Mercerized ...","tv, audio & cameras",All Electronics,4.4,149.0,699.0
Crysendo Headphone Cushion Compatible with Plantronics C-320M/ C3220 /C325M /T110 | 5MM Thick Replacement Foam Sponge Ear ...,"tv, audio & cameras",All Electronics,4.2,299.0,849.0
2022 New Cleaner Kit for Keyboard Soft Brush 5 in 1 Multifunction Computer Cleaning Tools Kit with Keycap Puller (Red),"tv, audio & cameras",All Electronics,3.9,95.0,999.0
"PiBOX India, Micro HDMI to HDMI Cable, 4K 60Hz , 1.5 Meter 5 feet, Adapter Ethernet Audio Return Compatible for Raspberry ...","tv, audio & cameras",All Electronics,4.2,297.0,699.0
"ikis - Screen Cleaner Kit 100 ml for LED and LCD TV, Computer Monitor, Laptop, and iPad Screens - Pack of 2","tv, audio & cameras",All Electronics,3.7,120.0,450.0
BRUSTRO A3 Double Sided Self Healing Eco Friendly 5 Layers Cutting Mat Metric/Imperial 45cm x 30cm Black,"tv, audio & cameras",All Electronics,4.6,499.0,840.0
Amazon Brand - Solimo Acrylic 360 Protection Border Back Cover for LG G8X ThinQ (Black),"tv, audio & cameras",All Electronics,4.0,189.0,499.0
AKOTI 8 Piece Wall Mounted Storage Box Remote Storage Organizer Case for Air Conditioner TV Mobile Phone Plug Holder Stand...,"tv, audio & cameras",All Electronics,3.7,297.0,599.0
20pcs Naruto Anime Sticker Pack Fan Art from animo India Perfect for Laptop Computer Car Water Bottle Travel Case Guitar L...,"tv, audio & cameras",All Electronics,5.0,99.0,499.0
ONUMTZ USB Fast Charger Magnetic Charging Cable Adapter for Fire-Boltt 360 SpO2 Smartwatch (Black),"tv, audio & cameras",All Electronics,3.3,199.0,999.0
"ZEBRONICS Firestorm Gaming Mouse pad for All Mouse sensors with Micro-Textured Fabric Surface, Anti Slip Rubber Base, 350x...","tv, audio & cameras",All Electronics,4.6,249.0,499.0
CEDO Back Cover Redmi 9 Prime | Matte Soft Silicon Flexible | Camera Bump Protection | All Side Shock Proof Rubberised Bac...,"tv, audio & cameras",All Electronics,4.1,149.0,999.0
JGD PRODUCTS for OnePlus 8T / OnePlus 9R Premium Transparent Hybrid Soft Slim Dust Proof Back Case Cover with Camera Prote...,"tv, audio & cameras",All Electronics,4.2,165.0,699.0
"Smashtronics® - Case for Firetv Remote, Fire Stick Remote Cover Case, Silicone Cover for TV Firestick 4K/TV 2nd Gen(3rd Ge...","tv, audio & cameras",All Electronics,4.2,199.0,499.0
KABEER ART 3 Sizes Water Brush Pen for Watercolor Calligraphy Drawing Tool Marker,"tv, audio & cameras",All Electronics,4.1,189.05,400.0
Winble Silicone Camera Protection Soft Silicon Protective Back Cover Back Cover Back Cover for OnePlus Nord CE 2 Lite 5G D...,"tv, audio & cameras",All Electronics,4.0,299.0,999.0
Crysendo 60mm / 6cm Cushion for Jabra Evolve 30/20/ 65 UC/ BIZ2400 Headphone | Replacement Memory Foam & Softer Protein Le...,"tv, audio & cameras",All Electronics,4.3,499.0,849.0
Tough Lee (Pack of 2 Tempered Glass Screen Guard for Samsung Galaxy F04 / M04 / M13 / M13 5G / M33 5G / M42 5G / M12 / M02...,"tv, audio & cameras",All Electronics,4.0,255.0,999.0
CEDO Samsung M31 / F41 / M31 Prime Tempered Glass | Screen Protector Full HD Quality Edge to Edge Coverage for Samsung Gal...,"tv, audio & cameras",All Electronics,3.8,199.0,999.0
Zebronics Zeb-Comfort+ Wired Mouse,"tv, audio & cameras",All Electronics,3.6,139.0,299.0
"Duracell Ultra Alkaline AA Batteries, Pack of 6","tv, audio & cameras",All Electronics,4.5,285.0,300.0
Pikkme Samsung Galaxy J7 Prime Flip Cover Magnetic Leather Wallet Case Shockproof TPU for Samsung Galaxy J7 Prime (Blue),"tv, audio & cameras",All Electronics,4.1,199.0,999.0
"New iPhone Latest Top up Bluetooth Version Cable for iOS 13 and Later, Audio AUX Converter Cable iOS to 3.5mm Headphone/Ea...","tv, audio & cameras",All Electronics,3.9,249.0,999.0
"SARTE Car Long Range AM/FM Replacement Audio Antenna for Car i20, baleno, Swift, Verna, New i10, Grand, City, Jazz, cr-v (...","tv, audio & cameras",All Electronics,3.6,279.0,290.0
TheGiftKart Back Cover Soft Case for Samsung Galaxy A23 4G / A23 5G | Best Camera Protection | Inbuilt Dust Plugs & Anti-S...,"tv, audio & cameras",All Electronics,4.3,265.0,999.0
Amazon Brand - Solimo Protection Matte Finished Back Cover Case for OnePlus 6 | Rubberized TPU | Slim Thin Soft Matte Flex...,"tv, audio & cameras",All Electronics,4.4,159.0,499.0
"Crysendo Headphone Cushion for Boat Rockers 550 Headset Replacement Ear Cushion | Earpads, Ear Cups Soft Protein Leather, ...","tv, audio & cameras",All Electronics,3.9,449.0,849.0
M.G.R.J® Portable Carrying Case Cover for Marshall Emberton/Marshall Emberton II Bluetooth Portable Speaker (Hard|EVA|Black),"tv, audio & cameras",All Electronics,4.5,859.0,999.0
"Matlek 2.4G Small Wireless Keyboard - Ergonomic and Comfortable Keyboard for - Desktop, Laptop, Tabs, Mobile Phones, Smart...","tv, audio & cameras",All Electronics,3.8,649.0,990.0
CROSSVOLT Type C VOOC Flash Charging Cable Compatible for Oppo Reno/2/2Z/2F/Reno 10x Zoom/k3(C Type Cable Charger),"tv, audio & cameras",All Electronics,4.2,289.0,999.0
Amozo Camera Protection Soft Back Case Cover for OnePlus Nord 2 5G / OnePlus Nord 2 5G Pac-Man Edition (Soft Silicon | Black),"tv, audio & cameras",All Electronics,3.9,299.0,999.0
CEDO Redmi 8 Back Cover | Matte Soft Silicon Flexible | Camera Bump Protection | All Side Shock Proof Rubberised Back Case...,"tv, audio & cameras",All Electronics,4.0,199.0,999.0
"Yogi MART Foldable Wooden Laptop Bed Tray Table, Multifunction Lap Tablet Desk with Cup Holder, Perfect for Eating Breakfa...","tv, audio & cameras",All Electronics,4.7,399.0,799.0
TheGiftKart Sleek Back Cover Case for iPhone SE 2020 / iPhone SE 2022 | Protective & Slim Fit | Ultra Matte Finish | Camer...,"tv, audio & cameras",All Electronics,4.7,269.0,999.0
CZARTECH Tempered Glass For iPhone XR/11 Screen Protector With Easy Cleaning Kit (Pack of 1),"tv, audio & cameras",All Electronics,3.9,299.0,799.0
"Uniball Eye Ball Point Pen - Blue Ink, Pack of 5","tv, audio & cameras",All Electronics,4.4,375.0,450.0
"ORCHID ENGINEERS - Welcome Gesture Lady Design Remote Holder/Organizer For Tv Ac Dvd Dth Remotes, Living Room Decor, Showp...","tv, audio & cameras",All Electronics,4.3,449.0,799.0
"TOYPORIUM Style My Home LCD Writing Tablet 8.5 inches Electronic e-Writers Graphics Tablets, Erasable Portable Drawing Doo...","tv, audio & cameras",All Electronics,3.5,160.0,499.0
Amazon Brand - Solimo Mobile Soft & Flexible Shockproof Back Cover with Cushioned Edges Transparent for Apple iPhone 5s,"tv, audio & cameras",All Electronics,4.2,139.0,499.0
WOW Imagine Soft Silicone Case for Apple iPhone 7 | 8 - Shockproof 360 Degree All Sides Protection with Anti Dust Plugs Sl...,"tv, audio & cameras",All Electronics,4.0,259.0,999.0
Mobile Phone Stand Wall Charger - Adapter Charging Holder Hanging Stand Bracket Support Charge Hanger Rack Shelf Cell Phon...,"tv, audio & cameras",All Electronics,5.0,209.0,899.0
Hello Zone Exclusive Matte Finish Soft Back Case Cover for OnePlus Nord CE 2 Lite 5G - Black,"tv, audio & cameras",All Electronics,4.0,169.0,699.0
Hola TF-600 CLI Caller ID Corded Wall Mountable Landline Phone for Intercom and EPABX Desk (Black),"tv, audio & cameras",All Electronics,3.6,799.0,849.0
Generic Universal Microphone Shock Mount Cradle Holder Clip Stand Mic-57000479MG,"tv, audio & cameras",All Electronics,3.7,315.0,399.0
WOWSOME Silver Universal Conversion Plug - 3 Pin Socket Worldwide Adaptor UK/US/EU/AU To Indian (2pcs),"tv, audio & cameras",All Electronics,4.1,251.0,400.0
"Tizum Gel Mouse Pad Wrist Rest Gel Foam Mousepad,Cushion Wrist Support & Pain Relief, Suitable for Gaming, Computer, Lapto...","tv, audio & cameras",All Electronics,4.4,449.0,999.0
Planet Waves Lemon Oil_Natural cleaner and conditioner Protects your (Guitar),"tv, audio & cameras",All Electronics,4.5,417.0,500.0
"Portronics Toad 27 Wireless Mouse, Silent Buttons, 2.4 GHz with USB Nano Dongle for PC/Mac/Laptop, Auto Power Saving Mode,...","tv, audio & cameras",All Electronics,4.0,499.0,599.0
TheGiftKart Genuine Liquid Silicone Back Cover Case for iPhone 14 PRO | Soft Micro-Fibre Lining Inside | Camera Protection...,"tv, audio & cameras",All Electronics,5.0,279.0,999.0
Epaal® Spiral Triple Color (2 Pcs) 1.4 Meters Each-Full Size Cable Cord Charger Protector Saver Winder for iPhone & Androi...,"tv, audio & cameras",All Electronics,4.3,189.0,299.0
Tukzer Universal Replacement Disc Tips Precision Round Shape Replaceable Stylus Pen Disc Tips for Touch Screen Devices – (...,"tv, audio & cameras",All Electronics,3.8,329.0,899.0
TheGiftKart Shockproof Crystal Clear Back Cover Case for Mi Redmi Note 12 Pro 5G | 360 Degree Protection | Protective Desi...,"tv, audio & cameras",All Electronics,3.7,199.0,999.0
Sangra Printed Bookmarks of Synthetic Paper | Book Lovers Gift | Gift for Readers| Pack of 21,"tv, audio & cameras",All Electronics,3.9,199.0,249.0
House of Quirk Electronic Bag Travel Cable Accessories Bag Double Layer Electronics Organizer Portable Storage Case for Ca...,"tv, audio & cameras",All Electronics,4.3,599.0,999.0
UNIGEAR Hard Travel Tech Organizer Case Bag for Electronics Accessories Charger Cord Portable External Hard Drive USB Cabl...,"tv, audio & cameras",All Electronics,4.1,369.0,799.0
Pikkme Redmi 9 Prime/Poco M2 Flip Cover Case | Leather flip Back Covers Cases for Redmi 9 Prime/Poco M2 (Blue),"tv, audio & cameras",All Electronics,4.2,199.0,999.0
GreatDio (Alpine) A4 Folder Case Presentation Line Transparent Report File -10 Pieces,"tv, audio & cameras",All Electronics,3.7,299.0,558.0
TheGiftKart Tough Armor Bumper Back Case Cover for Mi Redmi Note 12 Pro Plus 5G | Ring Holder & Kickstand in-Built | 360 D...,"tv, audio & cameras",All Electronics,4.3,329.0,999.0
"ESR Clear Case Compatible For iPhone 14 Plus Case, Shockproof Thin Silicone Cover, Yellowing-Resistant Slim Transparent TP...","tv, audio & cameras",All Electronics,4.3,474.0,699.0
(Renewed) HP Wireless Mouse X200 (6VY95AA),"tv, audio & cameras",All Electronics,3.7,489.0,899.0
Doubledicestore Tempered Glass Screen Protector Compatible for Redmi Note 12 pro 5G / Note 12 Pro Plus/Note 12 5G with Edg...,"tv, audio & cameras",All Electronics,4.1,139.0,999.0
NoWorries - Creative thoughts Motivational Quotes Scratch-Free Vinyl Laptop Skin/Sticker for 15.6inch/14inch Laptops [Size...,"tv, audio & cameras",All Electronics,3.9,239.0,659.0
boAt Bassheads 225 in Ear Wired Earphones with Mic(Red),"tv, audio & cameras",All Electronics,4.1,699.0,999.0
"ORICO EVA SD Card Case Holder for Memory Cards,24 Slots Professional Water-Resistant Anti-Shock Holder for 12TF Card and 1...","tv, audio & cameras",All Electronics,4.3,683.0,689.0
"Sellingal Hard Disk Drive Pouch case for 2.5"" HDD Cover WD Seagate Slim Sony Dell Toshiba (Black)","tv, audio & cameras",All Electronics,4.3,195.0,499.0
Lapster Microfiber PU Leather Sleeve Bag Pouch for MacBook pro Charger and Wireless Mouse Storage Laptop Adapter USB Cable...,"tv, audio & cameras",All Electronics,4.1,247.0,999.0
"TheGiftKart Back Cover for OnePlus Nord 2 5G (Poly Carbonate, Polymer | Blue)","tv, audio & cameras",All Electronics,4.2,369.0,999.0
"MI Smart LED Bulb with Adjustable Brightness, B22 Base Compatible with Amazon Alexa and Google Assistant (White)","tv, audio & cameras",All Electronics,3.9,500.0,699.0
Zapcase Back Case Cover for Mi Redmi Note 10 Lite/Redmi Note 9 Pro/Redmi Note 9 Pro Max/Poco M2 Pro | 360 Degree Back Cove...,"tv, audio & cameras",All Electronics,3.5,229.0,899.0
CROGIE DX1 Smart Tracker Key Finder Locator Anti Lost Wireless Anti Lost Alarm Sensor Device Finder Mini PET for Kids Loca...,"tv, audio & cameras",All Electronics,3.6,239.0,499.0
Spigen Essential Sand Blast Back Cover Case Compatible with Galaxy M33 5G (TPU | Matte Black),"tv, audio & cameras",All Electronics,3.1,599.0,799.0
"Camel Artist's Oil Color Box - 9ml tubes, 12 Shades","tv, audio & cameras",All Electronics,4.4,340.0,450.0
Astigo Compatible Sony TV Remote Control (Works with Most Sony LCD/LED TV) RM-L1370,"tv, audio & cameras",All Electronics,3.5,360.0,899.0
CEDO Xiaomi 11i (5G) / 11i HyperCharge (5G) Case Back Cover Shockproof Bumper Crystal Clear | 360 Degree Protection TPU+PC...,"tv, audio & cameras",All Electronics,4.3,229.0,999.0
"JK Excel Bond - A4, 100 Sheets, 90 GSM (Pack of 3)","tv, audio & cameras",All Electronics,4.5,360.0,550.0
KIPZO® Type C to 3.5mm Headphone Earphone Audio Jack Stereo Converter Connector Adapter for Samsung S10 Lite M40 S20 A80 S...,"tv, audio & cameras",All Electronics,3.8,340.0,899.0
"ETUZI Silicone Remote Cover Compatible for Fire TV Stick (3rd Gen, 2021) with All-New Alexa Voice Remote Case (Remote Not ...","tv, audio & cameras",All Electronics,4.1,249.0,999.0
"Amazon Basics USB Type-C to USB-A 2.0 Male Fast Charging Cable for Laptop - 6 Feet (1.8 Meters), White","tv, audio & cameras",All Electronics,4.3,279.0,795.0
"Smashtronics® - Case for Firetv Remote, Fire Stick Remote Cover Case, Silicone Cover for TV Firestick 4K/TV 2nd Gen(3rd Ge...","tv, audio & cameras",All Electronics,4.2,199.0,499.0
Renata Cr 2430 Lithium Battery (1Pc Blister Pack),"tv, audio & cameras",All Electronics,4.2,279.0,499.0
"Elecshion (Full-Coverage) Privacy Screen Protector for iPhone 11 and iPhone XR(2 Pack), Anti-spy Tempered Glass Screen Pro...","tv, audio & cameras",All Electronics,4.4,399.0,999.0
CEDO Hard Plastic Case OnePlus Nord Ce 2 Lite (5G) | Rotating Ring Holder & Kickstand in-Built | Military Grade Armor | Bu...,"tv, audio & cameras",All Electronics,4.0,299.0,999.0
"Lightning to 3.5 mm Headphone Jack Adapter for iOS 13 and Later, Audio AUX Converter Cable iOS to 3.5mm Headphone/Earphone...","tv, audio & cameras",All Electronics,3.5,249.0,999.0
TheGiftKart Tough Armor Bumper Back Case Cover for Realme 10 Pro Plus 5G | Ring Holder & Kickstand in-Built | 360 Degree P...,"tv, audio & cameras",All Electronics,4.0,349.0,999.0
Pikkme Samsung Galaxy A50 / A50s / A30s Smoke Cover Protective Shockproof Matte Hard Back Case Cover for Samsung Galaxy A5...,"tv, audio & cameras",All Electronics,4.0,199.0,999.0
NOCXTUN 360 Degree Rotation Mini Tripod Support Stand for DSLR and Smartphones - Foldable Shockproof Lightweight Bracket f...,"tv, audio & cameras",All Electronics,3.9,99.0,799.0
TheGiftKart Tough Armor Bumper Back Cover Case for Mi Redmi Note 11 Pro/Pro Plus 5G | Ring Holder & Kickstand in-Built | 3...,"tv, audio & cameras",All Electronics,4.3,399.0,999.0
M.G.R.J® PC Plastic Frame Shell Anti Scratch Shockproof Case Cover Compatible for Apple Watch Series 8/7 (45mm) (Black),"tv, audio & cameras",All Electronics,3.5,228.0,999.0
HAPYSA World Map Extra Large Extended Anti Slip Rubber Gaming Mouse Pad & Keyboard Desk Mat for PC Computer Laptop,"tv, audio & cameras",All Electronics,4.6,409.0,799.0
Beetel B15 Basic Corded Landline Phone (Warm Gray),"tv, audio & cameras",All Electronics,3.9,549.0,729.0
Yumin Polyester Handlebar Universal Mobile Holder Mount Pouch Bag Waterproof for Activa Jupiter EV Ola-S1 Pleasure Ntroq_A...,"tv, audio & cameras",All Electronics,4.2,379.0,999.0
SupCares Edge to Edge Tempered Glass for Samsung Galaxy S22 and Galaxy S23 (6.1 Inch) with Easy Self Installation Kit | Black,"tv, audio & cameras",All Electronics,3.6,349.0,799.0
"Gaiatop Mini Handheld Fan, Portable Personal Folding Cooling Hand Fan Rechargeable Battery Operated Power Bank with 2 Spee...","tv, audio & cameras",All Electronics,4.0,499.0,899.0
"Amazon Brand - Solimo Polycarbonate, Thermoplastic Polyurethane Back Cover for OnePlus 9R (Soft & Flexible Back Cover) Tra...","tv, audio & cameras",All Electronics,3.3,159.0,399.0
Winble Back Cover For OnePlus 9R ( Silicone|Black ),"tv, audio & cameras",All Electronics,3.6,299.0,999.0
Vipul Enterprise Multi-Purpose Wall Holder Stand for Charging Mobile Just Fit in Socket and Hang Pack of 1 (Mutlicolor),"tv, audio & cameras",All Electronics,4.5,177.0,499.0
"Lerobo Sport Band Compatible with Apple Watch Band 38mm 40mm 41mm 45mm 44mm 42mm for Women Men,Soft Silicone Sport Breatha...","tv, audio & cameras",All Electronics,4.5,499.0,999.0
Amazon Brand - Solimo Back Cover Case for REDMI Note 4 | Compatible for REDMI Note 4 Back Cover Case | 360 Degree Protecti...,"tv, audio & cameras",All Electronics,4.0,139.0,299.0
CEDO Case iQOO Z6 Lite (5G) Case Back Cover Shockproof Bumper Crystal Clear | 360 Degree Protection TPU+PC | Camera Protec...,"tv, audio & cameras",All Electronics,4.2,229.0,999.0
Pikkme Redmi Note 7 Pro/Note 7 /Note 7S Flip Cover Case | Leather flip Back Covers Cases for Redmi Note 7 Pro/Note 7 / Not...,"tv, audio & cameras",All Electronics,4.2,199.0,999.0
